national_park,review_body,review_date,review_title,helpful_vote,user_location,user_rating
Acadia National Park,The views from this park are amazing! My husband and I were visiting Portland and decided to make the 3 hr drive to the park. So glad that we did!!,"July 2, 2019",Incredible!,0,"Simpsonville, South Carolina",5
Acadia National Park,"Acadia is beautiful and varied. There are mountains, wooded trails, ponds, streams, and glorious ocean views. The hiking trails run from smooth and easy to very challenging. Bicyclists will love the carriage roads and kayakers the ocean and lakes. Spread around Mount Desert Island, the park offers something for everyone. Bar Harbor is lively in the warm months and the western side of the island is quiet for those wanting peace and relaxation. Those who live year-round on the island are welcoming.","July 2, 2019",This park has it all,7,"Indianapolis, Indiana",5
Acadia National Park,"Acadia National Park is a beautiful area to visit. We went to the top of Cadillac Mountain for the sunset which was incredible. We went to Frenchman Bay, Schooner head, Sand Beach and Jordon pond. We had lunch at Jordan Pond House which was very good. There was a large crowd but we only had to wait 5 minutes for a table and our food came very quickly.","July 2, 2019",Maine trip,3,"Defiance, Iowa",5
Acadia National Park,Spent a lovely morning going around the exquisite Jordan Pond. About 3.4 miles around the entire pond. We started clockwise from the entrance. This side boasts more marshy areas that are traversed via raised platforms. Volunteers were adding to the platforms so we were detoured a little ways through the woods. A bit muddy after heavy rains. The next section is mostly granite rock which is fun for those without mobility issues. The other side of the pond boasts a broad firm-packed walkway. Everyone brings their pets to Acadia so be aware. Parking on a busy (beautiful) day may be difficult. Best to arrive earlier or later for the most serene experience.,"July 2, 2019",Beautiful easy hike. Lots of families & dogs!,0,,5
Acadia National Park,Great hiking trails with easy access parking areas are set among some of the most breath-taking scenery on the east coast.,"July 2, 2019",Great Hiking!!!,1,United States,5
Acadia National Park,"It is worth the drive to get to the top of Cadillac Mountain (named for Mr. Cadillac). The park is serious about erosion and conservation, not allowing visitors to walk on the rocks, and not allowing more than 2 buses at a time at the top, for a stop of only 20 minutes. Parking is a walk from the vistas, but well worth it all to take in the view. It must be spectacular in autumn.","July 2, 2019",Breathtaking views,25,"Gainesville, Georgia",5
Acadia National Park,"We did so much in the park, Cadillac Mtn., Jordan's Pond, walked from Sand Beach to Thunder Hole (great overlooks and rock formations), hiked Acadia Mtn., Otter's Cove, so many great things to do. The drive is very scenic, a definite must do!! ","July 1, 2019",Beautiful area,62,"Maggie Valley, North Carolina",5
Acadia National Park,"Simply stunning! So we arrived here on a bad weather day but boy was it worth going back the second day! The first day was Sunday June 30 and raining and the parking lots were either half or mostly empty due to the weather. The second day we had a bit of a late start and it was much busier but not overwhelming. We did not do any hikes. Here are tips:1. Car or shuttle? - I was told time and time again don’t drive but I decided to ignore the advice and take my chances and I’m glad I did. This was my experience so perhaps it could differ as we get further into summer but when we went it was a bad weather day mid afternoon and driving was fine! The road was completely open for driving throughout the park unlike places like the Grand Canyon where it’s closed partly to only buses. We were fine the next day too which was a Monday and very Sunny. Again all roads open for major attractions including sandy beach, thunder hole, Cadillac mountain and Jordan pond. If you take the car and it’s a sunny day, start early!! We took a drive out to sea wall and didn’t get to Acadia for the second day until about 915. Sandy beach was pretty full In terms of parking and so was Jordan pond. Cadillac mountain was totally full and there was a wait for parking. People also weren’t quick to leave. 2. When to go and can you do it all: like I said above start early if you have nice weather! Like 730 or 8 so you can take time at the popular sites. If you do this you may be able to visit all the popular sites by car. Start with sandy beach, then thunderhole, ottercliff, Cadillac mountain and then Jordan pond. 3. Buy an America beautiful park pass if you’ll be visiting this park for several days and other parks in the us: one day pass for a car is 30 and the pass for a year is 80 unless you’re retired.4. Visitor center: worth stopping by to get maps and visit the shop. Some nice souvenirs but tee shirts are overpriced and you can find some nice ones in town at bar harbor. There are lots of steps going up but there’s also an accessible entrance. Restrooms also here.5. Sandy beach: a must stop! No dogs allowed. Public restrooms. Beautiful view. Parking lot fills up fast. If you don’t find parking here get out of the lot and park on park loop rd. 6. Otter cliff: signs aren’t readily visible. Parking is right before you get to a bend with tiered walled roads that split in two. Park before you get to the tier and walk across the street. Lovely views here on the rocks. 7. Thunder hole: hit or miss. Visited TWICE and no action unfortunately. We went at low tide and two hours before high tide and even stayed an hour but no action. Heard that action happens when there’s a storm and it’s two hours before high tide. Who knows though. Restrooms here but think they were the outhouse kind. Also a small gift shop and parking lot. 8. Jordan pond: parking lot at the house but also for just those visiting the pond a little further down the road. Nice views and worth the stop. Food is not worth the stop. Wrote a review about it and you can check it out. Restrooms available here. 9. Cadillac mountain: go early as this gets busiest fast! People also spend time up here so parking doesn’t change over quickly. Great views. If you can’t find parking there are a few pull over places on the way down with nice views too. 10. Last tips. Part of park loop is one way. Cadillac and Jordan has areas of two way lanes. There are adjacent and perpendicular roads but pay attention to signs because they’re easily missed and the next thing you know you’re driving around the whole park again! Cell service is very spotty so don’t think google maps will save the day. Don’t stay past close to dusk as the park empties quickly and it’s easy to get lost as there are no road lights in the park. People frequently park in the right lane on the one way roads so watch out! Lots of pedestrians on roads to in random places so take care! ","July 1, 2019",We did the park in a half day (twice!) by driving ,34,"Bethesda, Maryland",5
Acadia National Park,"We spent a week in Bar Harbor and went to Acadia every day. It is so beautiful, rain or shine. Our first day there it was raining hard but we saw some beautiful waterfalls that day. On the sunny days, we got up early and were at the park by around 6 am in order to beat the crowds so we could look for wildlife and do some hiking. We particularly enjoyed seeing the nesting peregrine falcons and their fledglings at Precipice Trail and also on the carriage road above Jordan Pond. There is so much to see and do but you have to get out of your car and hit the trails or carriage roads to really experience all the park has to offer, especially the wonderful smell of Christmas trees.Traffic was not bad during the early morning hours and we usually left by noon everyday. Be careful before starting any trails and don't start without a map, especially if you are not used to climbing rocks. Our only complaint would be the water runoff problem at Hulls Cove Visitors Center. When it is raining, water is rushing down the path and steps that you have to walk up to the building. It was like a water fall and then was puddled 3"" deep at the bottom. There was no way to walk around the water so everyone was having to walk through it. Our shoes and socks were soaked. Someone needs to fix that soon.","June 30, 2019",Didn't Want To Leave,5,"Rome, Georgia",5
Acadia National Park,We went for day trip from recent cruise. The park is so beautiful. Lots of hiking trails and amazing views from catillac mountain. We also went to sand beach and thunder hole. Public bathrooms were clean. Lots of one way roads when driving so pay attention. ,"June 30, 2019",Beautiful national Park,3,"Palm Beach Gardens, Florida",5
Acadia National Park,"Very nice national park, wear your good walking/hiking shoes, there is wonderful trails and places to go. Enjoy!!","June 30, 2019",Wonderful and stunning ,11,"Greenville, South Carolina",5
Acadia National Park,"I took a tour bus from Bar Harbor through Acadia Park. The tour was wonderful and we learned a lot of history. My tour stopped at the top of Cadillac Mountain, thunder hole, and Jordan's Pond. If you are on a cruise ship like I was this if the way to see this area.","June 29, 2019",Worth seeing. Beautiful view,0,"Wilmington, Delaware",5
Acadia National Park,"The national park is so beautiful and if you are a hiker this is the place to go. The weather can be dicey, a lot of rain at times. Have to catch it on a good day. ","June 29, 2019",Great Hiking & Beautiful,96,"Coeur d'Alene, Idaho",5
Acadia National Park,We took the Loop Road by car. It was $30 and we were given a map of all the sights to see. We spent the entire day here and it was incredible. Absolutely beautiful! I highly recommend,"June 29, 2019",Amazing!,4,"Worcester, Massachusetts",5
Acadia National Park,We have a fairly sedate family. So we didn’t do much hiking. We did enjoy stopping along the way and seeing sand beach and thunder hole and all those rocks between those two points. The kids said they did like Cadillac mountain. The drive close to veal harbor is beautiful on the loop. We drove out of the park to a little town for lunch close to seal harbor and then hopped back on and kept driving. It was not crowded and we were not stopped in long delays as cars backed up so if you did just want to cruise around you could make the entire loop in an hour. ,"June 29, 2019",Great time with family and great views everywhere. ,50,"Chengdu, China",5
Acadia National Park,There are so many trails and they can be super challenging to easy. We were there in May before peak season so it wasn't crowded.,"June 28, 2019",Something for Everyone,95,"Greensboro, North Carolina",5
Acadia National Park,This is a national park that should not be missed! A great option for those travelling from warmer states in the summer. Temperatures were in the 70's in July. The hiking is wonderful. Trails marked as moderate are accurately designated. Natural beauty abounds in this exceptional national park!,"June 28, 2019",National treasure!,6,,5
Acadia National Park,"We visited the park 3 different days while staying in Bar Harbor. Highlights were Cadillac Mountain, walk around Jordan Pond, and the many places to take pictures of the harbor. ","June 27, 2019",Must See National Park,18,,5
Acadia National Park,"Get a feel for the history of this area before entering the park, itself by strolling the history markers throughout Bar Harbor. Then, you can truly appreciate why this landscape is being preserved. Take your time and meander. Rely on the public transportation after the end of June to decrease impact on the ecosystem.","June 26, 2019",Auspicious Acadia,95,"Lutz, Florida",5
Acadia National Park,"This park is beautiful and has been designed to make it easy for people of all abilities to enjoy. Judging from the crowd control infrastructure, though, it may be very crowded at the height of the season. So, consider going a bit before or after for a better experience.","June 26, 2019",Nature at its best,51,"Queens, New York",5
Acadia National Park,"A very nice national park with lots of options of things to see and do. Cadillac Mountain was a good place to visit, but windy, windy,windy. The small gardens were nonetheless fun to visit. Caught thunder hole at the wrong time of the da and it was more of a gurgle than a thunder.","June 25, 2019",All in one place,38,"Englewood, Colorado",4
Acadia National Park,"We’re from out west so have a different reference point for national parks...this one is nice but isn’t drop dead amazing like many we go to out west. The rock beaches are actually very cool and have amazing rocks and pebbles that are worn perfectly smooth. The mosquitoes will eat you alive if you aren’t covered in something, and even then, sometimes they will still eat you. Acadia Mountain is a decent hike but again, hard to say that a mountain that is 600 ish feet tall is really a mountain. Tide pools were cool. We got lucky and found parking every time we wanted to do something, apparently this is not the norm. The weather is highly variable even on the same day in the same hike so have choices with you. If you’re here, it’s worth seeing.","June 25, 2019",Very pretty shoreline,105,"Salt Lake City, Utah",4
Acadia National Park,"Incredible National Park, and a must do if you are in the area. From the water, to the streams, to the history, to the rocks....you have to give it a try.We traveled in June and the park was not overly crowded. Recommend picking up a Junior Ranger book, especially if you have children, as it gives interesting facts and things to look for.We only had one day, and it was not enough. I would have loved to have had more time to spend in Acadia.","June 25, 2019",What a park!,29,"Pinehurst, North Carolina",5
Acadia National Park,"Had the opportunity to experience what Acadia National park has to offer, beautiful and natural, rich in history and places to visit.","June 25, 2019",Nature at its best..,17,"Edgewater, New Jersey",5
Acadia National Park,"I have been here before and this time we had our grandson with us. We spent a couple days touring the park and enjoying hiking, Cadillac Mountain, Sand Beach and Seal Harbor, The park has amazing views and is a great place to visit.","June 24, 2019",A day is not enough,21,"Muskegon, Michigan, USA",5
Acadia National Park,"this park is very beautifull, you have a see of the sea with nothings else than nature. the mountain are beautifull with a lot of trail to make. you will love this park, and since it's a national park, if you have your Yearly pass it's free to enter there !!! good visit","June 24, 2019",it's a must to make when you go to Bar Harbor,8,"quebec, Canada",5
Acadia National Park,"Such a beautiful park. Lots of trails. We walked around Jordan pond, took us two hours at a slow pace. Fun family activity. Not for little ones though. ","June 24, 2019",Beautiful,21,New Hampshire,5
Acadia National Park,"Acadia National Park is a beautiful place to experience nature. There are many paths to hike, places to see and experience, horse trails, and carriage rides. There are camp grounds and cafes. It is a very diverse park with many things for everyone. If you want to get out with a family this is a fantastic place. ","June 24, 2019",So Much to Do,114,"Minot, North Dakota",5
Acadia National Park,"Go to the Visitors Center first. Park for free if you have a National Parks Pass. (I have a Seniors Pass.) You only need to walk up the 52 steps to the Visitors Center if you need to buy a Park Pass. Get on the shuttle. (The #4 is the primary shuttle that goes everywhere in a little over an hour.) Get off at any stop (or not), check it out, get on a later shuttle. See beaches, trails, overlooks, picnic areas. If you know in advance which stop you want to visit (Sandy Beach for example), read the signs at the Visitors Center bus stop and get on the express shuttle to your location. Save on gas. Save the environment.","June 24, 2019",Free Shuttle to All the Best Locations,111,"New Lenox, Illinois",5
Acadia National Park,Loved hiking in Acadia. There is a hike for everyone's ability. We stayed in Otter Creek so were able to access some trailheads minutes from our AirBnB. I'd recommend staying in a place where you don't have to park. A lot more convenient. ,"June 24, 2019",Beautiful Park - Hikers Paradise,5,Usa,5
Acadia National Park,"The scenery is gorgeous, but because it was so crowded it was hard to enjoy. Parking anywhere was a big challenge and bicycles kept cutting off cars. I would recommend going here off season if possible to truly enjoy the scenery.","June 23, 2019","Over Crowded, But Beautiful",74,"Bluemont, Virginia",3
Acadia National Park,"Acadia National Park beauty at it's best! What stunning views and scenic pictures. No visit is complete without a visit. Make this a must stop when visiting Bar Harbor, Maine. ","June 23, 2019",Acadia National Park beauty at it's best!,3,,5
Acadia National Park,"good bicycling, but kept on raining, and the bugs were plentiful. Scenery is best on the Park Loop Road. The carriage trails are just woods. ","June 23, 2019",good bicycling,4,"Lisbon, Maine",4
Acadia National Park,Loop road and carriage roads were beautiful. Parking was not an issue in early June even though there were many tourists.Popovers and stew for lunch at Jordan Pond provided a perfect break followed by an interesting hike around the pond. Hike up to Bubble Rock was challenging with all of the mosquitoes but was worth the effort.,"June 23, 2019",Beautiful National Park,28,"Saint Louis, Missouri",5
Acadia National Park,"Rented bikes and did 22 miles of gravel roads in park...incredible views. Made loop around Eagle Lake and Jordan Pond, also saw rivers and a waterfall!","June 21, 2019",Awesome experience,1,,5
Acadia National Park,Acadia National Park is a true treasure. The scenery is absolutely breathtaking! Make sure to see Thunder Hole!,"June 21, 2019",Acadia National Park,1,,5
Acadia National Park,Bought park pass at visitor center in Bar Harbor. Park Loop road very nice especially the one way section with plenty of areas to pull off and directional signs very good.,"June 20, 2019",Very nice park,37,"Carrollton, Georgia",5
Acadia National Park,"a beautiful park Be sure to do the Loop drive for great views of the coast. Take advantage of biking, hiking.","June 20, 2019",Beautiful,3,Pittsburgh,5
Acadia National Park,"This was our third visit to one of the best National parks. It has great views of Maine's east coast. The rocky coast line, small beaches, trails, rocky mountain tops with fantastic views, small lakes/ponds, pine tree forests, windy roads, carriage roads....all great things to see and experience. We will visit again. ","June 20, 2019",Scenic views of a great National Park on the coast of Maine,36,"Dushore, Pennsylvania",4
Acadia National Park,Acadia is seriously underrated! Such a gorgeous place to spend the day. I believe the $30 per vehicle gets you a three day pass to the park. Lots of places to pull over and hike or have lunch. We witnessed a beautiful wedding ceremony taking place on the cliffs. Stunning views!,"June 19, 2019",Gorgeous Park,267,North Carolina,5
Acadia National Park,"We took a guided tour for a couple of hours. As others have said, the views from the top of Cadillac Mountain are beautiful. The history of the area is interesting. Well worth a visit.","June 19, 2019",Beautiful views,44,"Weirton, West Virginia",4
Acadia National Park,Smaller than most parks but beautiful scenery. Worth a day or two walking and hiking. I suggest early season before the crowds are too large but a busy park anytime. ,"June 19, 2019",Small but beautiful,110,"Simpsonville, South Carolina",5
Acadia National Park,"Such an amazing National Park with beautiful vistas. Was only in town for a day, so was only able to see a small portion. Will definitely plan to return and explore more!","June 18, 2019",Amazing!,121,"chicago, il",5
Acadia National Park,"We entered the Acadia National Park and drove to the top of Cadillac Mountain. At the summit, we realized we needed a Park Pass. Cadillac Mountain is the highlight of Acadia. It is a fun drive and has lot of great views at the summit. We stopped by the Jordan Pond gift shop to buy souvenirs and the park pass. Initially, I thought $30 was a much little for Acadia National Park. It was nice, but I thought overpriced.Then, Jordan Pond saved the day. We returned to Jordan Pond, and it made the Park Pass worthwhile. Jordan Pond is a beautiful relaxing place. I would imagine the hike around this big pond would be awesome.We enjoyed the drive around Acadia National Park. Acadia National Park isn't near the level of Yosemite, the Grand Canyon, Rocky Mountains or Crater Lake. However, it is a nice park in Maine and one of the best attractions.","June 18, 2019",Wonderful National Park near the Maine Coast,362,"Katy, Texas",4
Acadia National Park,"We loved Acadia National Park. The highlights were Sand Beach, the Great Head hike, the Otter Cliff coastline, Cadillac mountain, and we actually hiked and liked Acadia mountain on the other side of the island as well. We did think that Jordan Pond was underwhelming for the hype. We also went over to the Bass Harbor Head Lighthouse which probably wasn't worth the drive over. Basically any of the mountains with views over the ocean or hikes along the ocean, we thought were stunning and amazing. ","June 18, 2019",Loved Acadia National Parkw,83,"Dallas, Texas",5
Acadia National Park,"Acadia may be a smaller National Park, but it has plenty to see and do. That is why you will want at least 3 days and more if possible to experience this park. Take a hike as there are easy to very demanding hiking trails.The scenery on one of these hikes is remarkable. Take a bus tour to hear the information and gain a better understanding of the park and how it came to be. Take a carriage ride if time and weather permits. Do not forget your camera as between the shoreline scenery and the mountaintop vistas you will want to save the experience. We came at the request of our daughter and boy were we glad we visited. Outstanding park.","June 18, 2019",Absolutely Beautiful,4,"Chesterton, Indiana",5
Acadia National Park,"The weather was very nice the day we were there, albeit a bit chilly. Cadillac summit was fogged in so the views were optimal. Hikes for people of every capabilities. Many bridges, some dating back to the 20s.","June 18, 2019",Beautiful Park,140,"San Jose, California",5
Acadia National Park,"We brought our children here and now our grandchildren. We have been averaging a visit every three years for the last 30 years. Hiking, biking and kayaking are all top notch. Hiking is great because you can find trails for all ages. Great views from the top and many super views going up or coming down or both. Some have ladders, some iron rungs and others with beautiful granite steps. Scrabbling over rocks is fun for all ages. The biking trails were once carriage trails and one can still book a ride on a carriage but bikes are perfect. Many beautiful bridges were built and are beautiful as well as functional. As you bike up mountains you are rewarded by ever expanding ocean views. Kayaking can be in the ocean or on placid ponds. Views and wildlife are beyond words. Throw in some Jordan Pond popovers and Beals’s Lobsters and life gets no better.","June 17, 2019",Our Favorite National Park-a Giant Playpen For Everyone,8,"Johnstown, Pennsylvania",5
Acadia National Park,"Our entire family with six children ranging from age 7-20 enjoyed our vacation to Acadia National Park and Bar Harbor. It is well worth the trip to visit and hike in this park with amazing views and different levels of intensity for hiking. The park rangers were helpful with our planning, too, while there. ","June 17, 2019",Great family vacation!,2,"Stuarts Draft, Virginia",5
Acadia National Park,"Traveled to Acadia for my birthday. The weather was perfect. We rode the Park Loop and stopped at every area that we could. Stepped into the ocean at Sand Beach, listened in at Thunder Hole, lunched at Jordan Pond House, all beyond beautiful. We got up for the sunrise atop Cadillac Mountain and there's just nothing like it! We can't wait to return!","June 17, 2019",Breath taking views!,7,"Fitchburg, Massachusetts",5
Acadia National Park,"Hiking in the park was amazing, there are trails for beginners to experts. The views near the coastline are so beautiful I did not want to leave!","June 16, 2019",Amazing views,1,,5
Acadia National Park,walked and ate and breathed the air...paradise. Recommend this beautiful park. Bring your hiking gear and your appetite!,"June 16, 2019",Oh to walk and enjoy the smell of the ocean and the views,29,"Fredericton, Canada",4
Acadia National Park,"Took a tour with a local company. Was better than driving on your own, unless you plan on picking or doing trails. This is a beautiful place.","June 15, 2019",Awesome,3,,5
