national_park,review_body,review_date,review_title,helpful_vote,user_location,user_rating
Acadia National Park,"This park has so many layers! Start by hitting the main spots and then delve deeper into it. Tons of trails and attractions to choose from. We fell in love with this park and want to go back and stay for a whole week. We only did 2 nights there. Drive around Ocean Path and park at every parking lot and get out and look at the amazing sights. Walking that trail isn't really necessary. Save your energy for a more exciting trail that you can only access on foot. You should go in the evening when everyone is leaving. There was tons of parking then. It does get CRAZY crowded. Be prepared to park far away from some things and walk a bit if you go in the morning or afternoon especially. Wild Gardens was like that. Very crowded. Sand Beach also very crowded but great if you want the sandy beach experience. We were there to explore, so we only stopped briefly to see it. If you are not a plant buff, skip the Wild Gardens. I wouldn't do them again, though I did love taking pictures of the dew on the leaves and the few flowers and blueberries that were in bloom there. It's a quick stop if you want to do it. You can easily avoid crowds by going deeper into the trails or going early in the morning or else in the evening. If you want a fairly easy hike with amazing coastal rocky views and waves splashing - do the Ship Harbor Trail on the quiet side! We loved it and it only takes like an hour if you don't stop - maybe 2 if you stop and sit on the rocks or go tide pooling. This park is huge and beautiful and wonderful. ","July 15, 2018",Breathtaking adventure!,14,"Pittsburgh, Pennsylvania",5
Acadia National Park,There is so much to experience in this expansive and beautiful park. I have been dozens of time and each visit offers something new. ,"July 15, 2018",Best National Park,7,"Brewer, Maine",5
Acadia National Park,"If you are going to be in Bar Harbor, this is a must see Park ! Incredibly scenic views, amazing coastline and wonderful weather !Cadillac Mountain might not be that tall, but it definitely provides a panoramic view of the waters around Bar Harbor !We took a tour bus here, but it was obvious that many people drove up. Parking is limited, so we were glad to be on the bus !","July 15, 2018",Beautiful Park !,180,"Sarasota, Florida",5
Acadia National Park,"While the state park pass price caused some pause, really glad we spent a day exploring Acadia national park. Enjoyed the ocean views, went on a short nice hike, enjoyed the pop-overs at the lake lodge (forgot name), and Cadillac mountain views are spectacular (a must see)!","July 14, 2018","Acadia is beautiful, worth the trip!",3,"Beaverton, Oregon",5
Acadia National Park,"I forget how cool the U.S. is sometimes and when I travel it really blows my mind. An underrated spot; everyone will find something they love. Good food, culture, and amazing nature.","July 14, 2018",There's no other vacation this affordable and amazing,16,"Kitty Hawk, North Carolina",5
Acadia National Park,We have visited all 50 states and Acadia National Parks is one of our favorite places to visit. Hiking up Cadillac Mountain for sunrise is spectacular.,"July 14, 2018",One of our favorite national parks.,14,"Hendersonville, North Carolina",5
Acadia National Park,"Acadia is a beautiful national park, but the crowds can be difficult to deal with in the summer. Get up early and visit Cadillac Mountain and the loop road and then you can truly enjoy the experience. Route 3 into Bar Harbor is under construction and one way so a lot of extra traffic is in the park through 2019. The less crowded parts of the park are Northeast and Southeast Harbor park roads and Schoodic Peninsula.","July 14, 2018",Beautiful but crowded in summer,95,"Collinsville, Illinois",4
Acadia National Park,Our favorite place in the entire world and we have been fortunate enough to have been several places. We return here almost every year and have been doing so since 1979. Each time here we are able to find a trail we have not yet hiked. How is that possible?,"July 14, 2018",Perfect in every way,122,Lake Tranquility,5
Acadia National Park,"we only live about a 4 hour drive from here but had never visited. It is so amazing, views are just beautiful!! Sand beach is one of the most beautiful beaches I have ever been to and the top of cadillac mountain is spectacular Park staff are extremely friendly and helpful. $30 per car is the biggest bargain around!","July 14, 2018",spectacular,11,"Melrose, Massachusetts",5
Acadia National Park,We thoroughly enjoyed our tour of the park. The driver was very well informed and gave loads of information about the park.,"July 14, 2018",Took the bus tour of Acadia and it was great.,5,,5
Acadia National Park,We went in peak season and all the picturesque spots were packed. We did not walk the trails or bike the carriage roads and maybe that experience would have been better. We used the free buses (which are excellent and take bikes) to get around some of the time which solved the nightmare of trying to find parking. Certainly a beautiful area but so is a great deal of Maine. You can get the same scenery but without the crowds by going up country. Won't be going back - at least not in the summer. ,"July 14, 2018",Beautiful but crowded,8,"Eastbourne, United Kingdom",3
Acadia National Park,Beautiful National Park but the most rugged scenery was harder to locate. I wish we had been able to hike to some of those views. Very green and the water is beautiful! ,"July 13, 2018",Acadia Scenery,397,"Dallas, Texas",5
Acadia National Park,This is a scenic wonder of a National Park! You must stop and take the short hikes to get into nature here!,"July 13, 2018",Great short hiking trails with high reward views!,11,"Kailua, Hawaii",5
Acadia National Park,What a immaculate park. This is so well maintained. So many areas to stop and take photos along the road. ,"July 13, 2018",BEAUTIFUL,24,"Brighton, Michigan",5
Acadia National Park,"If you've not visited, make the trip! the views from Cadillac Mountain are terrific and the park is so scenic. Great hiking and sightseeing in this park.","July 13, 2018",Best national park in the US,62,Sun Prairie,5
Acadia National Park,"We've visited several national parks, but this one is easily a favorite. We love when there is historical significance also associated with such beautiful landscapes. From hiking down to Sand Beach up to Beehive Trail then chasing from one Rockefeller bridge to the next on the Carriage Roads our kids had a blast. Kids still ask about hiking Beehive Trail again, just wish we were closer and we'll definitely try to make it back to Acadia.","July 13, 2018",Fell in love with Acadia.,38,"Salt Lake City, Utah",5
Acadia National Park,"Was a wonderful park to visit. We had a great time at Jordan Pond, must have the Popovers at the restaurant there. We went to top of Cadillac Mountain, beautiful view of the area. We hiked Great Head trail which was a good moderate hike. And really enjoyed getting to see Thunder Hole. We took the bus in and out of the park and was super convenient.","July 12, 2018",Amazing National Park,1,"Clive, Iowa",5
Acadia National Park,"We like to go to national parks and walk. This one has a great walk between Sandy Beach and Otter Cliffs--the views of the coast are fantastic. It is 2.2 mile and fairly flat with good trail to walk on. Most people park in Sandy Beach to do the walk, but even though it is a large parking lot, it fills up quickly. We drove to Otter Cliff and parked there and walked back to Sandy Beach. We then caught the free bus which took us back to our car. If you this starting at Sandy Beach, you can't catch the bus as the road is one way between the stops.","July 11, 2018",Don't miss this park!,86,"Peoria, Arizona",5
Acadia National Park,Acadia is just beautiful... One of the highlights of our Bar Harbor trip was watching the sunset on one of the pull offs on Cadillac Mountain. Finishing our trip tonight by going to view the stars on Sand Beach!,"July 11, 2018",So much to see and do ,7,,5
Acadia National Park,"I love this national park. Free buses, going on several routes, took me to many of the trailheads. I could pick those suited to my abilities and even in busy July, I was often alone on one of the myriad trails - hearing birds, smelling pines, and feeling cool breezes. This place is magic.","July 11, 2018",Wonderland of Nature,4,,5
Acadia National Park,Acadia is my favorite go to place. It combines mountains and the sea for a great place to hike and get into nature. There are a variety of trails where you can lose yourself and just get away. The food and small towns that surround the park are also fun.,"July 11, 2018",My Favorite Place,18,"Macungie, Pennsylvania",5
Acadia National Park,"We walked from Bar Harbor to the park and then explored for the day. I have to say this exceeded my expectations - absolutely beautiful. We are used to Banff National Park so we are familiar with touristy towns and beautiful scenery......this was wonderful. Really enjoyed walking the carriage roads and finding the beautiful bridges. Great history here, beautiful scenery and relatively close to town. Hope to go back!","July 10, 2018","Love the hiking, beautiful scenery and the carriage trails are wonderful to see!",79,"Calgary, Canada",5
Acadia National Park,"The park is absolutely one the the most beautiful places I have ever been to. Spectacular mountain views, crystal clear ponds, and fabulous hiking trails. If you love the out-of-doors, don't miss it. It also is a photographers paradise, so take your camera. One week is not enough time to do all that it has to offer. We will return again.","July 10, 2018",Gods' Country!,48,"Havre de Grace, Maryland",5
Acadia National Park,This is the iconic wonder of New England National Parks. Easy to drive yourself and tons of tours to choose from.Highly recommended ,"July 10, 2018",Absolute Must See,45,"New London, Connecticut",5
Acadia National Park,Always a great time coming to Acadia. Every hike has breath taking views. The park and the campgrounds are very well maintained. ,"July 10, 2018",Gorgeous Park,0,"Worcester, Massachusetts",5
Acadia National Park,"We visited the park the last week of June. We drove the Park Loop Road and stopped at the easier trails. We can't hike as far or as long as we use to, but there were plenty of trails around Sand Beach, Jordon Pond, Carriage Roads and Cadillac Mountain that we enjoyed. The vistas in this park are amazing! I hope we can return in the future.","July 10, 2018",Amazing!,23,Florida,5
Acadia National Park,"Watch the sunrise and sunset from Cadillac Mountain. The beauty of the island is all around you. Take you time to enjoy the peace around you. Trails, trees and water. Nothing could be better.","July 9, 2018",Beautiful,24,"Derby, New York",5
Acadia National Park,"There's so much to do I returned for a second visit, which I spent in the Mount Desert area of the park. Enjoyed hiking the trails and the beautiful scenery in this park. Well worth exploring!","July 9, 2018",My 2nd visit...,12,"Washington DC, District of Columbia",5
Acadia National Park,Excellent views. Great parking. Plenty of picnic places to choose from.Fresh seafood and different modes of transportation bar harbor,"July 9, 2018",Amazing views,2,"New York City, New York",5
Acadia National Park,"We traveled to Bar Harbor by cruise ship in May, and made reservations for the bus tour of Acadia National Park online before we left. It was a short, but uphill hike from the tender dock to the bus. We had time to look around Bar Harbor before the bus left and enjoyed looking in the shops. The bus was not over-full but there weren't many empty seats. (If you want to do this tour, you probably ought to make your reservations well in advance) Since it started life as a school bus, leg room was minimal, but my bride has short legs and I sat by the aisle so we did fine. The drive to Acadia was pleasant. Once we entered the park, the scenery got even more spectacular. Our driver/guide knew A LOT about the area and freely shared his knowledge without being pushy. As we drove through the park we made several stops where we were able to walk out into the park and enjoy even more magnificent scenery. We're going back in the fall and have already purchased our tickets for our second trip into the park. ","July 9, 2018",A breathtaking experience,17,"College Station, Texas",5
Acadia National Park,Beautiful National park with lovely mountains and the beautiful ocean. This is an amazing national park and would recommend for anyone who loves to be outdoors. Very nice facilities and well maintained trails.,"July 9, 2018",National Treasure,23,,5
Acadia National Park,"A must see if you visit Maine. Absolutely beautiful! Make sure you visit Cadillac mountain, the views are something you remember for the rest of your life.","July 9, 2018",Acadia national park,2,,5
Acadia National Park,Cool summertime weather. Great for hiking or whale watching. Easy to drive around the park even during busy summer season. Less crowded that other famous NP's. Cadillac Mountain hike takes much of the day but is worth it. Bring sturdy hiking shoes.,"July 9, 2018",Best Northeastern National Park,2,Pompton Plains,5
Acadia National Park,"We took a very challenging loop that was about five miles long and climbed two (approx 700 ft) mountains. The trails labeled strenuous really are! There was a lot of boulder climbing involveled, particularly climbing Acadia. The way down was easier and there were some rudimentary steps carved into the boulders but the direction we took was challenging. We have two very fit preteens who had no trouble with it, but I, the mama, struggled a bit. It was beautiful, smelled amazing, due to the trees and was really a step out of normal life. There were goorgeous views of Soames Sound from both peaks. There was nothing that looked like civilization and we saw very few (maybe 10 total) other people along the way. We just followed the blue paint spots, which weren't always easy to find, especially along the aptly named Ledge Trail.","July 9, 2018",Acadia Mountain and St. Sauveur,21,"Houston, Texas",5
Acadia National Park,The parks was just simply beautiful. The beach in the park was nice. The shuttle ride through the park was great and time saving if you didn't want to walk. A must see to enjoy.,"July 9, 2018",Breath Taking Views,8,"Capitol Heights, Maryland",5
Acadia National Park,"This is one of my favorite places to be, so quiet, relaxing, scenic, and the ocean breezes are the best. Drove through the park and did some hiking. Make sure your there in the morning @ Cadillac Mtn for the early morning sunrise, You'll be the first in the US to witness this amazing sunrise. Stayed in Bar Harbor, did a 5 mile kayak trip...was a bit sore but a great experience. Just love this area of the country. Especially my lobstahs!!!","July 9, 2018",God's Playground,4,"Prescott Valley, Arizona",5
Acadia National Park,"Spent a couple of days driving around the park and found some beautiful spots, including the biggest surprise which was a sandy beach (I understand these are quite rare on the Maine coast). Jordan Pond was a stunning as all of the pictures I had seen online and Thunder Hole a difference from the norm. Unlike many National Parks in the US (Yellowstone, Rock Mountain, Yosemite etc) I don't think this park is one to see wildlife, other that spotting the occasional beaver dam and a few sea birds. It's visually stunning though so well worth a first if you travel to the region. Only $20 entry fee as well so very reasonable pricing.","July 9, 2018",A beautiful National Park with diverse scenery,82,"Sheffield, United Kingdom",5
Acadia National Park,"Beautiful views from any where in the park. Ocean Path and Otter Cliffs were my favorite spots. Sunrise on Cadillac Mountain @ 4:45am was amazing.. Three days in the area was not enough. Stayed in Bar Harbor, only minutes to the park.","July 9, 2018",Breathtaking views,4,Wisconsin,5
Acadia National Park,"We spent several hours hiking in Acadia. The views are amazing! Because I was with teenagers we took the more difficult trails that involved a lot of climbing, but there were trails for all abilities.","July 8, 2018",challenging,22,"Dallas, Texas",5
Acadia National Park,Absolutely breathtaking views and invigorating hikes. Our family of 15 LOVED every bit of Acadia. Favorites were Thunder Hole although we missed the 2 HR before high tide so it sounded more like a plunged toilet. The scenery was amazing. Jordan Pond was serene. We loved Otter Cliffs and Bubble Rock ( the later is quite the hike....felt that the next day!). Perfect for some awesome pictures and some funny trick photography. We highly recommend sunrise on Cadillac Mt.....heavenly. There were about 1000 people there but it was so quite and peaceful. Just beautiful! This is a must see,"July 8, 2018",AMAZING,2,Maryland,5
Acadia National Park,"If you are an admirer of this nations natural splendor and rugged seashore is your thing, look no further - this place is nirvana. We stayed in Bar Harbor and had no problems with traffic or crowds in late June. The hiking and natural beauty is spectacular. In four days I did not see one piece of trash or one bit of graffiti anywhere. The staff here does a great job and everyone was so well behaved and respectful. ","July 8, 2018","The best National Park on the East coast, and I've been to most of them.",18,"Fleming Island, Florida",5
Acadia National Park,Acadia is just beautiful. We drove around Park Loop Rd and up to the top of Cadiallac Mountain. Had popovers at Jordan Pond after many trials to get a parking space. We did not use the trolley or bus that takes you into the park. Parking is tight in popular areas like Sand Beach and Jordan Pond. Look for parking areas across road near Sand beach area on Park Loop Rd. Walked along the coast and lake. Very hot when we were there. Bring water. And a camera! Wear good shoes if walking on rocks and paths.,"July 8, 2018",Just beautiful,6,"Charlotte, United States",5
Acadia National Park,We brought our own bikes from home to ride around Eagle Lake. We were hoping to cover Jordan pond but it was a little farther than our family is used to biking. We took lots of water and had a great time. I highly recommend stopping at the Park Ranger center before you go to get a carriage trail map. They can tell you what is doable based on the abilities of your family. ,"July 7, 2018",Beautiful family-friendly bike ride around Eagle Lake,3,,5
Acadia National Park,"Hard to park and a bit crowded, but totally worth it. Get OUT of your car and hike the trails. Bike the carriage roads. It's worth it. ","July 7, 2018",Amazing Park!,14,"Chicago, Illinois",5
Acadia National Park,"If your into hiking trails, this is the place to be. This is a very clean park, with many places to see what you think is the best scenery. Only to discover yet another amazing sight to see","July 7, 2018",Trails for everyone,2,,5
Acadia National Park,"A must see, add to your bucket list if it isn’t on there! The views are absolutely incredible and many hiking options available. We hiked Cadillac Mountain which can be a bit challenging but well worth it. A lesson learned - bring plenty of water!","July 7, 2018",Family trip,4,,5
Acadia National Park,Great hiking and views for everyone to enjoy. Great easy trails for any age to enjoy. Crowded in early July but everyone helpful and polite. ,"July 7, 2018",Family vacation in Bar Harbor & Park,5,"Athens, Georgia",5
Acadia National Park,"I don't know what it is like to drive into the park personally, because we went with a tour. The park is very pretty, though we happened to be there on a very foggy day, so we didn't get to see the vistas as well as I would have liked. However, the whole park is meant to be a place to relax, enjoy nature, and get away for the hectic ness of life. In the, it is a huge success. It is so serene and relaxing. I recommend finding out about a tour to enjoy the carriage roads, since there are so many places you cannot go by vehicle.","July 7, 2018",Went on a Tour,215,"Northern Virginia, Virginia",4
Acadia National Park,A spectacular park with views of water and mountains and splendid hiking trails. We stayed for two days and it felt like we should have stayed longer. ,"July 6, 2018",Don't miss this!,64,"Chicago, Illinois",5
Acadia National Park,"We spent 1 1/2 days at this national park, and we were not disappointed. We arrived on day at 8am at the Hulls Cove Visitor Center, purchased the park pass, bought a few souvenoirs, and then proceeded on our entire day journey on the famous 27-mile Park Loop Road. We purchased an on-line tour guide for $5 (equivalent to the CD), which was nice. Each of the roughly 20 stops went from good to great. Great mountain views, rocky-shore lines, an amazing beach, the forest, and finished with the unbelievable views from the very top of Cadillac Mountain. You can walk/hike as little or as much as you want. On the 2nd day, we returned to the beach and spent a few hours in the rather cold ocean. This beach is surrounded by rocks/forest. I’ve seen nothing like it in the world. We will definitely return.","July 6, 2018",Simply amazing!,17,"New York City, New York",5
Acadia National Park,Alot of construction going to park. One way roads. Not enough parking. Not enough bathrooms. Long lines. Expensive for going for a day. Great if you are going for a week. Pass is 30. For a week. Beautiful park just alot of traffic and not enough parking. Great mountains and views.,"July 6, 2018",Honeys Mom ,11,"Sharon, South Carolina",4
Acadia National Park,"National Parks are a national treasure and Acadia is no exception. It's a gorgeous park with many different places to explore. We focused on one. The Ocean Path at Acadia National Park is a beautiful trail along the water. It's a wonderful hike for kids who like to climb rocks and explore. The photos we took are gorgeous. But the hike is listed as EASY which it is not. I mean, it's not super steep, but there were a lot of older people on the path struggling with the exposed roots and unlevel rock stairs. Everything I read about it made it sound easy but it was hard for the grandparents in our group and for many of the other grandparents I saw hiking. Mostly our issue was my parents not realizing their new limitations, but I'm passing on this warning as I saw quite a few of the 70+ crowd struggling. My husband and I offered many hands to people who needed it.","July 5, 2018",National Parks are a national treasure and this one is no exception.,10,"Chicago, Illinois",5
Acadia National Park,"We have been here twice, once in the fall for the color change, this time in the summer for the beautiful green landscape. It is an absolutely beautiful p,ace to spend a day. There are many hiking trails and rock climbing opportunities. We went on a tour from our cruise, so we could no partake in those. Go, but be respectful of the rules in the park, they are for your safety and enjoyment of the park.","July 5, 2018",Magnificent ,160,Chicago,5
Acadia National Park,"We absolutely loved it! Be careful of the Beehive! It’s a great trail, but you will be climbing a metal ladder up a cliff face! ","July 4, 2018",Beautiful!!! ,0,,5
Acadia National Park,"Spent a day on Cadillac Mountain, drive to south end of park to lighthouse. And, one of the best things, $30 Park pass fee was free with my senior pass. Beautiful place, hiked to the Bubbles, well worth the time spent.","July 4, 2018",Awesome,25,"Surfside Beach, South Carolina, United States",5
Acadia National Park,We came here for a couple days. One cant miss experience is to watch the sunrise from the top of Cadillac mountain. Just warning to make sure you get there at least 30 minutes before scheduled sunrise to get entire experience. Plus its very very crowded. ,"July 4, 2018",Outstanding sunrise,137,"Quakertown, Pennsylvania",5
Acadia National Park,"W went to the park during our stay in Bar Harbor and it is a beautiful park with great hiking trails and a very nice beach, although a bit rocky!!","July 4, 2018",beautiful!!,12,,4
Acadia National Park,"I'm Irish so rarely use the word ""Awesome"", this park is truly Awesome, especially Cadillac Mountain. This day was one of the highlights of our 2 week trip and I would really recommend.","July 4, 2018",Awesome : A must do,86,Cork,5
Acadia National Park,"The Park was beautiful, Cadillac mountain wondrous, the ferns were huge, and the trails very well marked. It was fun hiking along Acadia.","July 3, 2018",Spectacular,170,"Lexington, Kentucky",5
Acadia National Park,"When it comes to beautiful scenary few states can rival Maine in the fall; and, few parks are more beautiful than Acadia. The hardwood trees of Maine are rich in color. The color of the park against the backdrop of the northern coast of Maine creates an unforgettable of the majestic and serene. The area allows the traveler to visit some of the grand lighthouses, lending the park and surrounding area a touch of New England in times past. Though too many souvenir shops and stores that cater to the many tourist are beginning to overwhelm Bar Harbor's main street, it remains a quaint picturesque town. Our favorite spot to visit remains Cadillac Mountain. In the fall the temperature atop the mountain can turn quickly cold. It is best to carry a windbreaker to weather the cold brusque wind. Still, the color of fall that spreads before the visitor for miles is breathtaking and worth enduring the cold wind. Never will you breath cleaner air. ","July 3, 2018",Dr.,23,"Valdosta, Georgia",5
