national_park,review_body,review_date,review_title,helpful_vote,user_location,user_rating
Acadia National Park,"From the park entrance to the top of Cadillac Mountain-it was amazing. Mother Nature was having a great day when she created this area. From woods to rocky shore line. Check out every overlook, every view is different. Plan a full afternoon for the drive. We brought along a picnic lunch. Sat and ate watching wild turkeys. ","September 25, 2018",AMAZING!,58,"Baton Rouge, Louisiana",5
Acadia National Park,"We often travel in September after Labor Day when most kids are in school, but before the leaf peepers are out. That strategy didn't work for avoiding crowds in Acadia. We were able to get into the Hulls Cove Visitor Center, but it was crowded. Tried driving up Cadillac Mountain, but traffic was bumper to bumper near the top. We couldn't find a parking space and never got out of the car. On the way down, we saw that park rangers had just closed the road going up the mountain. The next day we tried going to the nature center - no parking. And Thunder Hole was just crawling with people. The parts of the park that we were able to see were wonderful.","September 25, 2018",Beautiful but crowded,37,"Indianapolis, Indiana",4
Acadia National Park,Beautiful park. Clean and great walking paths. Could see forever from the top of the mountain and was stunning.,"September 25, 2018",Beautiful Park,0,,5
Acadia National Park,"Sadly we only had one day to explore, which is clearly not enough time as this National Park has so much to see and do. We decided to get recommendations from the visitor centre and covered the main areas. You are able to drive around the Park which certainly saves some time getting to various locations. Stunning views along the way too. First stop was a drive to the top of Cadillac Mountain - awesome views at the top and well worth the trip - we then headed down and found a nice 3 mile loop trail to do - it was a bit tricky in places but really satisfying and some fantastic views of the ocean along the way. Love that the Park is doggy friendly too - wish we had our doggy with us. So much fun for them! Definitely want to come back and spend more time here.","September 25, 2018",Wish We Had Longer - Loved It,14,Grand Cayman,5
Acadia National Park,We were in and out of Acadia National Park for 4 days. You can drive around (or take the shuttles) and stop to see the amazing views on the many turn-outs. It was foggy often when we were there but still beautiful.,"September 25, 2018",4 day trip,1,"Grand Island, Nebraska",5
Acadia National Park,"We loved it here. Great park loop drive, amazing hikes with awesome views. but it was still very busy even in September.","September 24, 2018","Great park, but crowded even in September.",23,"b,pa",5
Acadia National Park,"We were surprised at how easy it was to get around. we caught the bus at the square in bar harbor and road into the park, getting on and off different buses, changing buses to change the direction we were going. Always easy to get on and never had to wait long. Did some hikes and just really enjoyed ourselves. ","September 24, 2018",Beautiful !,20,"Hampton, Virginia",4
Acadia National Park,This has to be one of the most beautiful parks in America. There are great hiking trails and is the only place to see fijords in the US. It is truly a magical place!,"September 24, 2018",The Gem of the East,81,"Clayton, North Carolina",5
Acadia National Park,"Although we battled fog for three days we loved the park. We had to make two trips up Cadillac Mountain to get a view and we did. The loop road trip was wonderful. This was fall so we really didn't spend any time at sand beach but it looked great. We had a very nice visit at the wild gardens and nature center with a one mile walk on the board walk, Missed Jordan lake Anne people raved about it and the carriage ride. We enjoyed the park from the nature tour boat out of bar harbor. Viewing the shore line is better from a boat","September 24, 2018",We had a foggy visit,4,Milford,5
Acadia National Park,Great place to come any time of the year one of the nicest parks on the east coast you could spend days here.,"September 24, 2018",Awesome,45,"Naples, Florida",5
Acadia National Park,"We were fortunate to have bright sunny days during our September visit, with only a little morning fog, so the views from Cadillac, Mt. Acadia, Beech Mountain, and Schoodic Point were all top notch. We have no quibble with the various sites and apps that rate the day hikes; as one local put it, ""they're all good -- enjoy the ones you choose and don't worry about the ones you miss."" That said, we made a point of getting up and out early, and looking for less busy trails. For us, a day hiking on Schoodic Peninsula was a day exquisitely well spent. We also came to understand why people bring camp chairs and just watch the tide roll in. What a show!","September 23, 2018",Beautiful in September and not as crowded,10,"Minneapolis, Minnesota",5
Acadia National Park,"The morning sunrise was beautiful. Seeing all the people there watching the sun come up on top of this hill was pretty cool. Cold and early. I definitely like the sunset at Key West better but sill this was nice, glad I did it. Wouldn't do it again. Signage in this expensive national park is moderate to poor, bathrooms are the visitors center are inside and it doesn't open till 8 so if you show up at 5 for the sunrise event don't go to the visitor's center. I know this park is listed as one of the top national parks I don't know why. Saw racoons and turkeys. We were lucky with good weather and great visibility. One person up at the morning sunrise event said this was his 3rd this week and the first with good weather conditions. At the top of the mountain the view of Bar Harbor is nice but you are so far away it is mostly dots on the camera. We visited Mt Battie two days ago. I think the views and pictures were better the admission was $12 for two including a car, at Acadia the admission is $30 for the car and $15 for each person - $60 total. For that amount of money I'd expect good signage and bathrooms open during big demand periods. ","September 23, 2018",It's a bucket list park,1,"Chalfont, Pennsylvania",4
Acadia National Park,One of the coolest places. You defiantly need an entire day here. And a lot of it is drivable. U can hike as much or as little as u want. We will be back bc we didn’t have enough time ,"September 23, 2018",Beautiful ,29,"Girard, Ohio",5
Acadia National Park,"You must see as much of this National Park that you can when on Mt. Desert Island! The park loop road is worth the drive but if you hike at all, get on those trails, the views are spectacular! They are a bit difficult, but if you are in shape it is worth the hike. ","September 22, 2018",Fantastic at every turn!,91,"Ludington, Michigan",5
Acadia National Park,This is a must see attraction when in the area. THere is not much around except for Bar Harbor that is about 3 blocks long but it is fantastic views and trails.Great food in the area and beautiful sights.,"September 22, 2018",SIMPLY SPECTACULAR !!!!!,173,"New York City, New York",5
Acadia National Park,"So, if you are looking for picture perfect green and water, you've hit the jackpot.If you are more into nature amazing creations, not it.As always, started at the visitor's center. Have entered through Hulls Cove.You park and need to go upstairs to the place itself in order to get a park permit, if you are not holding an annual one.Nice and smiley ranger was there, but the most unhelpful one I have encountered till today.The first thing you should know about the park, is that the trails are entwined into one another and you can make short ones, or longer as you see fit, which is awesome and this most important detail was known to me only when I was actually trekking.As for the list of trails, it isn't freely given with the map like other parks, you have to purchase it. I don't know what's on it, since I have relied on ""All Trails Pro"" which in hindsight, wasn't very useful either.You can see in the pics an example to how the trails are built.As for Camping, I went to the closer site, Blackwoods Campground, which is reviewed separately.First day I have parked in Sand Beach and went on the Ocean Path, which is more of a stroll, with niches to get very nice views of the ocean and Sand Beach, finished at Otter Cliffs and went back to the Gorham Mountain trailhead.At this point you can see how some trails can be combined.I have made the trail into a loop, that landed me back close to Sand Beach where my car was parked.Just follow the signs you want. You can't really get lost.Most of the trail is rocky and I would categorize it as moderate to easy. Back to Sand Beach and down the stairs to Great Head Trail.You cross the beach and there's a small U turn at the Beehive lake.You can loop that too. The way up is a little bit more challenging, the way down if you loop it, is easy.All the trails took me about 5 hours.Second day Jordan Pond.Take a right after a pretty boring mile and you have interesting trails - Bubble Rock, Eagle Lake. Uphill, some rocky. The north Bubble Summit is beautiful.Eagle lake not as much.The trails don't loop and I came out from the point I have entered.Then about 2 more miles back to the parking lot, around the pond.This way is a bit more challenging if you are just looking for a stroll.This has taken me about 4 hours and added up to about 7 miles.***wear proper shoes for Trekking***if you have T-mobile, there's no internet connection. It connects to AT&T and it's calls only. Highly recommend a drive through the island with the car.The park boundaries are blurred, so there's food, drinks and everything you want, just a little drive away. This is off season, so accommodation is easy to find in all price ranges.Trenton has a very cozy picnic area, with toilets, picnic table and a nice view.Have Fun","September 22, 2018","Not my top choice for national parks, but still something to be said",65,"Los Angeles, California",3
Acadia National Park,"This, to me, was a very small, urbanized national park. I really liked the busses inside the park. I'd also say this has to be the most dog friendly national park I have been to. The only negative is this park is also almost completely surrounded by houses, and it makes it hard to feel isolated, and it's just sad for the wildlife, they can't really come and go freely.I'd say if you want a vacation with your dog, with great restaurants, little shops, lots of history, and short hikes, this is the park for you.","September 22, 2018",Neat little park,26,"Las Vegas, NV",4
Acadia National Park,So I live here but visit the park often .. it’s aleays beautiful breathtaking.. if you visit please stay on the trails so the park stays beautiful and you stay safe. ,"September 21, 2018",Live in paradise,30,bar harbor maine,5
Acadia National Park,"So many things to do! Hiking, biking, kayaking. BEAUTIFUL! Would like to go back and spend more time doing other things.","September 21, 2018",AMAZING! Wish we had more time,20,"Winchester, Kentucky, United States",5
Acadia National Park,First time visitors. Can't wait to come back! We stayed at an Airbnb and can't wait to come back to experience more of what the park and surroundings have to offer.,"September 20, 2018",Early fall/late summer treasure,11,"Parrish, Florida",5
Acadia National Park,"My husband and I enjoyed every minute and every vista of this spectular place. My recommendation is to utilize the bus system they have in the park. Let them do the driving so you can enjoy more of the park. Parking spaces are also a premium inside the park. My favorite memory is stopping at Sand Beach and then walking the trial to Thunder Roll. It’s about two miles and easy. If you are a picture taker like I am, it might take you awhile. Breathtaking views, It will not disappoint. ","September 20, 2018",A National Treasure,1,,5
Acadia National Park,"We visited the park as part of a shore excursion , the scenic ride to the top of Cadillac mountain was wonderful and the tour around the park was beautiful.","September 20, 2018",Beautiful,142,london,5
Acadia National Park,"Wonderful drive up to the top and greeted with amazing views of Bar Harbor and MDI. Took a short walk around the hiking trails at the top but was concerned we might get a ticket. Apparently you are supposed to go to the Visitor Center and pick up a placard to show you paid. Never saw any signs and unlike all the other Nat'l Parks, we did not see a entrance booth to show Senior Pass. Go figure?","September 20, 2018",First time visit to Acadia,3,"Aptos, California",5
Acadia National Park,September is a spectacular time to visit Acadia! The weather was mild and the foliage was just starting to turn colors. The free shuttle bus is a wonderful way to get around. We stopped at all the main natural features and enjoying the immense variety. One full day was not enough for sure.,"September 19, 2018",Gorgeous National Park,54,"Dansville, New York, United States",5
Acadia National Park,This is a gorgeous park with vistas that are beyond words. It would take several days to experience even a fraction of its vastness. Unfortunately crowds of people are very close to ruining the splendor. The park service recommends taking the free bus. Great idea. Even in the “off season”there are very few parking spaces. You will find yourself spending most of you time circling the lot in search of a spot. Take food and water with you. Once you pass the gates there is nowhere to buy anything except Jordan Pond and very limited parking there. Lots of people so plan ahead. ,"September 18, 2018",Breathtaking views,28,"Atlanta, Georgia",5
Acadia National Park,"My last visit to Acadia National Park was 20 years ago, there were many improvements made by the park service on trails. A free shuttle bus from the visitors center takes you to various highlights in the park and reduces the car traffic and exhaust. Tickets are $30 and good for a week in the park The park loop road is about 30 miles. Highlights you should see are: Thunder hole, popovers at Jordans pond restaurant at the Bubbles, otter creek,Cadillac mountain and so much more. Just go!","September 18, 2018",Just go and enjoy,11,"Scituate, Massachusetts",5
Acadia National Park,"We got up early in the morning to beat the rush of massive people that decend upon this beautiful Nat'l park. We'd seen on the news how it gets so crowded and there's no parking, so we looked into taking a tour bus or shuttle, but in the end, we decided to drive and go in early. We did hit some fog which spoiled some views, but it began to lift and we seen plenty of the forest. Stopped at Sand Beach and Thunder Hole. It was a beautiful drive through the park that early foggy morning. ","September 17, 2018",Acadia Nat'l Park,5,,5
Acadia National Park,Acadia Park is a gem for all to experience and see! The scenery is beautiful and there is so much to view. We enjoyed Thunder Hole and were fortunate to hear it boom! You can see the park in a day but would recommend taking a couple of days to experience all of the Park.,"September 17, 2018",Breathtaking Adventure!,5,"Baudette, Minnesota, United States",5
Acadia National Park,"Three cheers to LL Bean. They help sponsor a great network of propane powered buses to get you in and around the park in the bar harbor out to the little airport and associated cities. No need to Rent-A-Car very timely service and comfortable. Great lobster is out by the airPort, wonderful shops in the village. Rent bikes from Bar Harbor bike rentals and ride the 40 miles of carriage built by the Rockefellers! Easy grade somewhere around 4%, get away from the crowds and see wonderful glacial lakes rock formations and coniferous forest.","September 17, 2018",Great biking trails on the carriage paths,7,"Hilton Head, South Carolina",5
Acadia National Park,"Having been to a number of National Parks, throughout the US, this is one of our favorites, exceeded only by Yellowstone. This combines mountains, the sea, rocky shorelines, great interior trails, mountain climbing, and amazing ‘carriage roads’ for biking without ever having to see a car.","September 17, 2018",Amazing Park,22,"Louisville, Kentucky",5
Acadia National Park,We would recommend doing the loop twice. Once at low tide and once at high tide. Totally different perspective between the two.The Hull Visitor Center was located 52 steps up. Strange to see a visitor center so far from the parking lot and with so many stairs. Not sure what they were thinking when they designed that :(,"September 17, 2018",Visit during low tide & high tide,127,"Toronto, Canada",4
Acadia National Park,"Where else can you sit on the beach and have a picnic lunch dipping your toes into the Atlantic Ocean, then turn around and climb the highest peak on the Eastern Seaboard.","September 17, 2018",My Happy Place!,8,"Cambridge Springs, Pennsylvania",5
Acadia National Park,"We spent a week on MDI and never left the island! We were in Acadia each day. There's so much to see and do. The hiking/walking paths, Jordan Pond, Sand Beach, Thunder Hole, the summit of Cadillac Mountain are just a few things to see and do. We drove the island each day, searching the small villages and towns for things to do and see. We found quaint shoppes and family owned restaurants. Take time to stop, pull off the road and explore!","September 17, 2018",We love Acadia National Park!,49,"Philadelphia, PA",5
Acadia National Park,We visited Bar Harbour and Acadia from a cruise ship. Spending time in Acadia is a must. It is such a beautiful area. ,"September 17, 2018",Such a wonderful place,2,,5
Acadia National Park,"If you ever get to main, you have to visit Cadillac Mountain. The drive is well worth it. The view from the top of the mountain is breathtaking.","September 17, 2018",Awesme Scenery,18,"Red Bud, Illinois",4
Acadia National Park,"We stopped here for lunch and weren't disappointed. The best seafood chowder I had on my entire trip. Would have liked to have hiked the 3.2 miles around the pond, but that will have to wait for a future visit.","September 17, 2018",Great lunch spot,11,"Champlin, Minnesota",4
Acadia National Park,Stunning 360 views from top of Cadillac Mountain and stargazing at night. Never seen so many stars and the Milky Way so vividly! ,"September 16, 2018",Pack your camera!,10,"Gastonia, North Carolina",5
Acadia National Park,"It is easy to drive the Park loop in a day and you can see the various sights along the way. The park is in the middle of the island, surrounded by little villages and bays along the shoreline. It gets crowded in the summer, so give yourself time.","September 16, 2018",A unique National Park,43,"Winter Park, Florida",5
Acadia National Park,Cadillac Mountain View’s were stunning. The park is very nice. The roads were a little arduous due to road work. Sand beach was a great stop; as was thunder hole. Well worth the $30 fee for our vehicle. The pass is good for 7 days. Sunset from Cadillac was very nice; but a little underwhelming. We should have done the sunrise. Oh well.....next time. ,"September 16, 2018",Beautiful views! ,26,"Winter Springs, Florida",5
Acadia National Park,"If I visit again I would avoid trolly tour and drive my own car. The park is very nice and views excellent. The tour guide was very knowledgeable, but too many grumpy seniors.","September 16, 2018",Beautiful,7,,5
Acadia National Park,"Acadia is a fantastic place to visit (five rating). Unfortunately, everyone seems to found that out and finding parking places can be very challenging (four rating). It almost feels like it is being loved to death in some spots. Nonetheless, if you can get to key destinations early or go off the beaten path, you will be rewarded. ","September 16, 2018",Acadia National Parki,3,New England,4
Acadia National Park,"My wife and I spent three days touring the park. The second day was rain and fog, providing an enchanted take on the natural beauty. The last day was bright and sunny. Repeating the circuit trip of day two provided a totally different perspective with equal beauty. I must say that the sun brought out all those too timid to tolerate the rain, so the sunny day was a bit crowded.","September 16, 2018",Beauty beyond expectation,15,"Upper Arlington, Ohio",5
Acadia National Park,"Friends and family who recommended this to us were not exaggerating. Acadia National Park has some of the best views in the North East. The only sandy beach we know of Down- East. The drive/hike along the peninsula has several amazing outlooks, all different. (Several are handicap accessible). Bring binoculars and watch the haws, perhaps a bold eagle or the waves. You can drive to the top of Cadillac Mountain where there is a gift shop and restrooms. Get an early start for parking.","September 16, 2018",Worth Every Minute,54,Connecticut,5
Acadia National Park,"Acadia is the most amazingly beautiful national park! It has it all from ocean beaches, mountains to climb, lakes to enjoy, trails to explore. It offers many options so that regardless of your physical abilities, there are places and trails to explore and enjoy. I really loved I could climb my first mountain. We meet some great people along the way from all over the US and other parts of the world. The park staff are incredibly helpful and knowledgeable. Great vacation and plan to be back again, and again and again!","September 16, 2018","Has it all-oceans, mountains, lakes, trails!",11,"Burnsville, Minnesota",5
Acadia National Park,First time experience and it is pristine. We especially loved seeing the sunrise on Cadillac Mtn and the trail around the pond. We would hike in the early morning hours and you would hardly pass another soul. So quiet you could listen to the water lapping. Great trip for all ages.,"September 16, 2018",What a treasure!,6,"Katonah, New York",5
Acadia National Park,"Acadia is absolutely beautiful! We hiked numerous trails in the park, went to scenic outlook spots, and enjoyed watching the waves crash against the shoreline. I am so glad my husband and I came here we made numerous memories that will never be forgotten.","September 16, 2018",Put this on your bucket list,4,"Dover, Pennsylvania",5
Acadia National Park,Highly reccomend the drive up Cadillac Mountain and the ferry to Schoodic Point. Wow stuff .... Beautiful waves crashing against the granite boulders.,"September 15, 2018",Beautiful!,14,"Palm Harbor, Florida",5
Acadia National Park,"The park has stunning views of the ocean, cliffs and awesome hiking trails. If we lived in the area we would frequent this park. Only wish it wouldn’t have rained for an entire day that we planned on being in the area. The hiking trails have stunning views, we also choose a horse carriage ride. ( had wanted to rent bikes to ride on the carriage roads but do to surgery we had to change plans) this was a great option to see the carriage roads and learn about the history of the park. ","September 15, 2018",Stunning views,1,"Sioux Falls, South Dakota",5
Acadia National Park,"If you are planning a trip to Maine, don't miss out on the beautiful national park! The shoreline views were stunning! Trails are well kept and gorgeous. You can bike or drive all over it too but be warned if you bike, it's very hilly. Parking can be a challenge and we visited on a very busy week but with a bit of patience, we were able to park everywhere we wanted as cars are always coming and going. You can also take the free bus from Bar Harbor and hop on or off. We are Floridians (aka flatlanders) in our 60's but we enjoyed the shoreline hike and the Jordan Pond hike, both relatively flat and just beautiful! Plan ahead and make reservations at the Pond House after your hike! We challenged ourselves with the Great Head Trail, a lot of which is uphill over boulders. It was hard for us but SO worth it! Do it if you're able. There are tons of others of varying intensity and at least drive up Cadillac Mountain for the views. Hats off to the bicyclists pedaling up the mountain!!","September 15, 2018",Don't miss this one!,16,"Ponce Inlet, Florida",5
