national_park,review_body,review_date,review_title,helpful_vote,user_location,user_rating
Acadia National Park,"Take your time in the area and allow at least 2 or 3 days to explore the various parts of the park, more if you are into hiking the numerous trails within the park. There are too many highlights to mention. Pick up a map at the entrance and try to do a loop around the park, but be sure to check times for best viewing at Thunder Hole. Definitely going back.","October 18, 2019",Natural Beauty,52,"Long Island, New York",5
Acadia National Park,"Acadia National Park is a true gem. Here you can experience the power of the ocean (Sand Beach, Thunder Hole), the majesty of mountains (Cadillac Mountain), and the serenity of the Jordan Pond. There is also the stillness of the forests, set ablaze on our October trip by the color change of the leaves in autumn revealing many more shades of yellow, orange, red and even brown than I previously knew. You can go by bike, go by hike, go by car or go by bus, but the key is GO! Go experience this breathtaking display of beautiful nature. You will be so glad you did. ","October 18, 2019",“Beautiful” doesn’t do it justice,12,"Miami, Florida",5
Acadia National Park,We spent day here and would have liked longer. It is well worth the $30 entrance fee. We drove up Mount Cadillac where the views were breathtaking. The Fall colours in the park were wonderful and there are plenty of parking/pull in areas so one can stop to admire the scenery and take photos. We were especially thrilled to see a family of white tailed deer.,"October 18, 2019",Brilliant!,121,"Reading, United Kingdom",5
Acadia National Park,We took an excursion that went through the park. We were able to get out a few times to see the vistas and enjoy the beautiful fall foliage. I would recommend a tour through the pro as we learned so much about the history of the park and facts about the great fire and the bridges. Really a nice day. I would love to go back and enjoy the trails. ,"October 18, 2019",Beautiful park,61,"Montvale, New Jersey",5
Acadia National Park,"We visited the Bar Harbor area and Acadia National Park recently. I have never been to New England and did not know what to expect. We truly enjoyed the beauty of Acadia National Park. We only spent two days in the park but enjoyed gorgeous hikes with stunning views of the Atlantic and the amazing display of colorful leaves in the Autums. Sand Beach was beautiful with its blue water. It’s an inlet and we hiked along the cliff trails surrounding the beach to outstanding views below of Sand Beach and the ocean. We drove to Cadillac Mountain where the wind was super gusty that day. There is a short hiking path there with panoramic views of the Atlantic. Also there is a small gift shop and bathrooms at the top if Cadillac Mountain. We visited Thunder Hole, but the waves coming in 2 hours before high tide did not make the loud clap of thunder sound that day. However, we were not disappointed because the waves splashing over rocks and just walking around the area made for a nice time. There’s a gift shop there, as well. While near Thunder Hole, we hiked to Cadillac Cliffs. This is a beautiful hike over rocks, under rock overhangs, and through the woods. We also hiked to one of the Bubble Rocks which was uphill and the forest was vivid with color. We drove to Jordan Pond, did a two hour, relatively flat hike around the pond. The hike had breathtaking views of the pond, more like a small lake, colorful leaves and a forested area. At Jordan pond, there’s a very nice gift shop and a restaurant. Acadia was beyond beautiful in October. In Bar Harbor, the town was a beautiful sea coast older town with great Inns, shops and restaurants. There was so much to do in Bar Harbor. You can take a few hours sea excursion, as well. My only regret is that the time we spent driving up highway1 and in Bar Harbor and Acadia was way too short. The National Parks our west are massive and jaw dropping, but Acadia certainly held its own with its own kind of beauty. I highly recommend a fall trip around the first or second week of October to this gorgeous area. ","October 18, 2019",Stunning ,37,"Estes Park, Colorado",5
Acadia National Park,This is such an amazing park to see! So many beautiful pull offs to enjoy the scenery and soak in the views. We had a rental car so we were able to take our time and enjoy it at our own leisure. It does cost $30 to get in for the day but it was well worth it!,"October 17, 2019",Amazing,1,"Nashville, Tennessee",5
Acadia National Park,"We took a small group tour through the park mid week in October. The crowds were great as everyone was there to see the fall colors. The colors in the park were stunning and it was nice to hear the history of the park from a guide. It was our first visit, so the tour was a great way to get acquainted with the park and its history.","October 17, 2019",Beautiful Park!,571,"Milwaukee, Wisconsin",5
Acadia National Park,"We stayed at the Atlantic Eyrie which is about a mile outside of Bar Harbor which I was glad of when I saw how busy Bar Harbor and the park were. The visitor center has a huge parking lot and it was almost full - despite the availability of shuttles. Given this the park staff have done an excellent job in making sure everyone has a quality experience. They have parking areas at strategic spots and allow parking on the side of the road near the interest areas - brilliant planning I say. What you do is drive down a mostly one way road and pull over and park at places that seem interesting or beautiful. The highlight is the top of Mount Cadillac which affords an incredible view of the the hillside and the bay. Winding up to the top there are also great views and at the top there is a large parking lot that circulates cars as people come and go and it seemed to accommodate all the visitors. There is a short circular walk you can take to see the view from all the sides. We also stopped at Sand Beach - very popular - and later drove to Eagle lake and hiked around it. You walk on a wide old carriage road until you get to the far end where you have a choice to walk on a trail instead, there is a stretch where you have to rock hop. Leaving the Island we stopped off at Ship Harbor enjoyed the nice walk with views of the estuary and the wild ocean. So. Its incredible and don't stress out because of the crowd because it will all work out.","October 17, 2019",Beautiful and Accessible,97,"Santa Cruz, California",5
Acadia National Park,This was our 2nd visit here and it certainly doesn’t disappoint!! Both times have been in the fall and the colors are beautiful!! Lobster is pretty good too!!,"October 17, 2019",Acadia National Park,2,"New Castle, Indiana",5
Acadia National Park,This is a great park. Lots if activities and vibrant colors. Well worth a visit in more 5han 9ne season. ,"October 17, 2019",Great Park,2,"Indianapolis, Indiana",4
Acadia National Park,The park is absolutely amazing. The views were great. It was extremely crowded when we went in early October due to all the people gathering to see the leaves change colors. Still worth the crowds to see it all!,"October 17, 2019",Don't miss Acadia!!,1,,5
Acadia National Park,I researched the best time for fall foliage the last 5 years and I will say it gave us the best time we hit peak! It made the scenery that much more beautiful such a beautiful fun place,"October 17, 2019",Best time for leaves,0,"Springfield, Missouri",5
Acadia National Park,We took a tour bus to take a glimpse of the Park. It was picturesque and the water areas nice.It was nice to hear about the area with a tour guide and we would've enjoyed the tranquil surroundings if we'd stayed longer. When your on a tight schedule its hard to just be and soak it up.,"October 17, 2019",Nice Drive,4,"San Antonio, Texas",4
Acadia National Park,"The views were absolutely stunning! All the fall colors were the reason I planned my trip here, and I was not disappointed.","October 17, 2019",Stunning!,0,,5
Acadia National Park,"We have thoroughly enjoyed hiking and seeing this beautiful National Park.....there are many, many trails to hike that it is difficult to choose which ones to hike. The park does get very crowded especially in some of the more popular locations...so get up early! We went in the fall so the colors were in abundance. We enjoyed the view from Cadillac Mountain and did many stops along the Park Loop Road that is 27 miles. It has taken us several days and there is more to see and do...","October 17, 2019",Beautiful,465,"Pahrump, Nevada",5
Acadia National Park,"We only had one day to visit Acadia this trip...but we’ll spend more time next visit. However, if you only have one day...get up early (5:00am) and drive to Cadillac Mountain for the sunrise. We arrived there at 5:30, and had a great parking space. You can see it from your car if you get a good space, but if you can, walk right out to the rocks to get a spectacular view. It’s a close walk...not hard or far. Even though it was a little cloudy, it was gorgeous!! Then, take a drive around Park Loop Road. Make sure you stop at Schooner Point and MAKE SURE to walk down the path there to the water. It’s absolutely amazing down there. Worth the walk and not too far down there. Also see Thunder Hole...it’s worth the stop. Both are right on the side of Park Loop Road. We made it around the Park Loop Road and saw these amazing sites and magnificent views in about 3 hours. But you can spend a few days there taking in the trails and Mt. Desert Island nearby. We were perfectly happy with our 3 hours though. Worth the stop even if you only have 3 hours. ","October 16, 2019",A MUST DO!!,2,"Pisgah Forest, North Carolina",5
Acadia National Park,Weekend crowd was maddening but after the long weekend it was entirely manageable. Had a blast walking along the coast on the massive rock formations along the shore. Cadillac Mountain is a come early as there fog/clouds roll Lin b and sock it in. Very windy. Great trails. Roads in good condition. Best to park at mid point lots and stay away from those next to the big attractions. ,"October 15, 2019",Fall color abounds! ,20,"Rogers, Arkansas",5
Acadia National Park,"I would recommend you take some kind of informative tour first to learn more about the park and how it was formed. Then, revisit the places you liked best on the tour. There are opportunities to rock climb, bike ride, picnic on the beautiful rocks along the ocean, etc.","October 15, 2019",Acadia is a beautiful National Park,17,"Oakdale, California",5
Acadia National Park,This park was so beautiful! We hiked along the Ocean path and was amazed by the views. Most of the trail is flat but there are places for you to climb off the path and get a better view of the ocean and the rocky shore line. ,"October 15, 2019",Beautiful Park,45,"New Albany, Indiana",5
Acadia National Park,"This was our second trip to Acadia and it didn't disappoint. We hiked for two days - the Great Head Loop Trail - Otter Cliffs, Thunder Hole, hike/walk around Jordan Pond, tea and popovers at Jordan Pond Restaurant, sunrise at Cadillac Mountain, the Beech Mountain trail and the Ship Harbor Nature Trail.","October 15, 2019",A fantastic early October trip to see the fall color.,3,"Richmond, Virginia",5
Acadia National Park,"What a beautiful national park. You might as well but an annual pass because you will be there every day. The leaves were changing color, the temperatures were a great relief from the Florida heat, and the sights were spectacular. Bring your hiking shoes and poles, you will need them. The Bernice trail, the Gorham trail and the top of Cadillac mountain are all must do's. Put this o your list","October 15, 2019",A hike to remember,31,"Lakeland, Florida",5
Acadia National Park,"Our tour of New England took us here last week. It was brilliant to be on top of “mountain” , feel the wind and cold and see the amazing views. ( but be aware, only two toilets here which can be a problem for a 20 minute coach stop for 47 people!). The area by the sea was very spectacular with crushing waves. Just a lovely park.","October 15, 2019",It just trees,0,"Ashby de la Zouch, United Kingdom",5
Acadia National Park,"We spent three days exploring the park during the peak of fall colors, it was beautiful and spectacular. Even with three days we still couldn’t see everything. We are in our 50s and hiked both the Bubble Rock and Beehive, both of which take skill and strength. If you want something less risky, the Ocean Path along the coast, and Thunder Hole are both excellent, easy walks. Parking is really a problem throughout the park during peak season, but you can find a spot with patience and good parallel parking skills. It is a trip of a lifetime, and we highly recommend it during the first or second week of October.","October 15, 2019","Excellent Views, both Driving and Hiking",15,"Jacksonville, Florida",5
Acadia National Park,"Although a windy day we still spent an hour CHILLING at the summit, BLOWN AWAY by the views! The terrain was a STEP UP from what we are used to but we ROSE to the occasion and had a TOP day out! On the way back down we got a bit lost as the signs aren't that clear. But the area is VIEW-tiful so we didn't really mind!","October 14, 2019",We a-DORR-ed the Mountain,0,,5
Acadia National Park,"Visiting from Arkansas, but grew up with Minnesota Falls. The views were beautiful and there are hiking trails and carriage roads so everyone can experience this great Park. We are seniors and are making our way through the National Park system. You will not be disappointed. Plus you can get lobster rolls at the Traveling Lobster!!Another must stop.","October 14, 2019",Beautiful Fall Colors,2,"Hot Springs Village, Arkansas",5
Acadia National Park,Words would be insufficient to explain the beauty of fall colors all around.A well maintained forest with lots of points to see including small beach.A must visit place.,"October 14, 2019",Mind boggling mountain.,1,,5
Acadia National Park,We enjoyed driving the loop road around Acadia. The scenery of the coast was very pretty. We also saw Bass Harbor Head Light which perhaps is not in the park itself but nearby. We wanted to eat at Jordan Pond Restaurant but it was packed and there was an hour wait so if you want to eat there and it looked great call ahead. We enjoyed the view from Cadillac Mountain but did not catch sunrise which is suppose to be gorgeous.For most visitors 2 days should be ample but allow more time if you like to hike.,"October 14, 2019",Great scenery and drives,47,"Rockwall, Texas",4
Acadia National Park,"I am from Maine and have been to Acadia a number of times; I love it. That it is gorgeous and a stunning national treasure has been said before, but the park service has to get a handle on the number of people in the park. I can't remember a time I've been there before that I saw as many people there as I did this time. Popular spots, like Sand Beach or Jordan Pond, are starting to resemble an LA theme park for the sheer number of tourists walking around with expensive cameras. Something has to be done. It was overwhelming and it will probably be a while before I go back.","October 14, 2019",Beautiful but...,12,"South Portland, Maine",4
Acadia National Park,"Gorgeous fall colors, interesting history. Took the carriage ride through the park, saw the sunrise from Cadillac Mountain (tip-take a very warm winter coat to this!!)","October 14, 2019",BEAUTIFUL!,1,,5
Acadia National Park,"Not much can be said that hasn’t already been mentioned. The park is gorgeous and incredibly well-maintained. The views from Cadillac Mountain were beautiful as long as you can handle the temperature. Early October and we had chilly rain and wind, but it was still very pretty and well-worth the effort. ","October 14, 2019",Immaculately gorgeous ,6,"Sunrise, Florida",5
Acadia National Park,"This park is a natural treasure and provides something for everybody! You need a park pass for every car, which also can be used to the Island Buss system.","October 14, 2019",A natural treasure !!!,223,"Waterloo, Belgium",5
Acadia National Park,"We visited the second week of October. The leaves were almost perfect and the park was not too crowded. The scenery is absolutely spectacular. This is a must visit place, especially at this time of year,","October 13, 2019",Spectacular Place to Visit,12,"Seattle, Washington",5
Acadia National Park,I can't say enough about the beauty of the park in fall. There are so many options for hiking and walking here. The carriage roads are magnificent. There are amazing bridges to see on these roads. I also liked that I felt safe hiking in the woods because there was no danger of bears.,"October 13, 2019",Beautiful,1,Louisville,5
Acadia National Park,I can see why millions visit every year. Absolutely beautiful and the views are amazing. There is such a variety of plant life. From the ocean to Cadillac Mountain. The colors were awesome.,"October 13, 2019",beautiful,1,"Rapid City, South Dakota",5
Acadia National Park,"We bought a cruise ship excursion to see sights in the park like Thunder Hole, Jordan Pond, and Cadillac Mountain to ensure we would get a tour of this park. The tour has a couple of short stops for Thunder Hole and Jordan Park and a longer stop at the top of Cadillac Mountain. Thunder Hole is only impressive when the tide is coming in; otherwise there is no spray coming up out of the blow hole. Jordan Pond has a nice restaurant with indoor and outdoor seating. Its popovers (2 for $8), a take on Yorkshire pudding, were popular and were served with jam. Its gift shop was stacked with jars of jams and bags of popover mix. Outside there was a path around the pond which gave us an opportunity to see what one of the carriage roads looked like. These gravel roads are mainly used by the horse and carriage ride businesses. As the bus climbs up Cadillac Mountain, there are many opportunities to see vistas of the Bay, small lakes, and forest trees - without human development or industry. In mid-September, the deciduous trees had just a hint of Fall coloring. The peak of Cadillac Mountain offers some rocky trails to walk along besides just standing at a rail to take pictures. We enjoyed our 27 mile tour of the island. On our way back to town, the bus driver drove past some of the summer homes built by wealthy families that weren't burned in the island fire a while back and through the town.","October 12, 2019",Did the 2 1/2 hour bus tour from the town to Cadillac Mountain and back,1252,"Vancouver, Canada",5
Acadia National Park,"I was here on a cruise tour, as such I only spent a day here. But it was just a very beautiful park. One of the smallest of the national parks, it is also one of the most beautiful.The view from the top of Cadillac Mountain is spectacular! Try not to miss this. My final verdict is that, as a nature lover, Acadia National Park deserves more than just a day trip!Try not to miss Thunderhole!","October 12, 2019",Beautiful Park. Worth a longer visit!,220,"New York City, New York",5
Acadia National Park,Beautiful foliage and views on the clear day we went. Would love to go back again and spend more time and explore on our own. We went on guided tour.,"October 12, 2019",Gorgeous park! ,3,"Midlothian, Virginia",5
Acadia National Park,"We just finished a three day stay at Acadia NP, at the height of the fall colors. It was spectacular! Acadia offers diverse terrain for hiking and biking, impressive coastal vistas, and quaint villages to stroll around. The only negative was the cruise ship crowd jamming Bar Harbor and the hiking trails on the east side of the island. Over 200 cruise ships a year!! At least they don’t typically get to the central and western island trails. ","October 12, 2019",Amazing foliage,8,"Winston Salem, North Carolina",5
Acadia National Park,Outstanding and worth every second of travel! Acadia exceeded our expectations and we can’t wait to return!,"October 11, 2019",So beautiful! ,1,,5
Acadia National Park,"Acadia National Park is a national treasure! Between crashing waves on the rocky coast to Sand Beach to untold number of hiking trails to beautifully groomed carriage trails to unbelievable views, Acadia has something for every member of the family! Any number of places to stay from fancy hotels to camping and lots of fabulous restaurants, you will love Acadia and Mt. Desert!","October 11, 2019",Incredible National Park,4,"Charlotte, VT",5
Acadia National Park,"Our kids are 5 and 7 and they made it through both these hikes and the Gorham Mountain trail in two days and had a blast. The mountain trail is quite taxing, but the view at the top is worth it. It is short and coming down is really fast so you can keep walking along the coast after that. Also, there are no restrooms at the Gorham Mtn trailhead, so plan accordingly. Stop by Thunder Hole and hear the awesome sound. This is a tourist bus stop so it is very busy. If you want to park there get there at 8am. There is a gift shop and restroom. Get your parking pass the day before you go if you can—it will be good for 7 days and is required for parking anywhere in the Park. The entire park has paved roads to each lot and the drive is nice too! ","October 11, 2019",Hike the Jordan Pond and The Ocean Path trails,16,"Washington DC, District of Columbia",5
Acadia National Park,We bought the CD audio tour and used it to tour the park. We spent the first day doing all the sites and went back the second day to hike around Jordan Pond. We went back to Mt. Cadillac a second time because the view was so amazing. There was a lot more hiking we could have done if we stayed longer.,"October 11, 2019",Loved this national park,34,,5
Acadia National Park,"We probably spent 1.5 days in the park (in the course of 3 days), hitting the highlights such as Thunder Hole and Schoodic Point. Our best experience by far was sunrise on Cadillac Mountain. As there are only 145 parking spaces, we were warned to arrive no later than 5:30 for a 6:30 event. As we were extra paranoid, we arrived at 4:40 and we weren't the first. Although it had rained the night before, the sky was absolutely clear and the magnificent Milky Way blazed overhead. I've never seen anything like it. The sunrise over the Atlantic was equally stunning. BE WARNED: the mountain is cold. When we left the house, it was 60 degrees. The mountain (at a bit over 1500 feet) had temperatures in the mid 30s and it was windy. We wrapped up in emergency car blankets. Arrive prepared.","October 10, 2019",Fabulous!,110,"Washington DC, District of Columbia",5
Acadia National Park,"What a fabulous place to visit, probably any time of year. However we visited in the fall. Trees & views amazing, organisation of the area was very good. The free bus service was much appreciated and certainly well used. A must for anyone to visit.","October 10, 2019","Definitely worth a visit, especially in the fall",10,"Chorley, United Kingdom",5
Acadia National Park,"We visited Acadia National Park over Labor Day weekend. We chose to drive ourselves rather than take the shuttle bus service. It was easier for our family of 5. We started each day bright and early. We found parking spots easily until about 10-11 am. The crowds really built up then. Get up to Cadillac Mountain early or late. By 11 am the line of cars to get a parking spot was very long. They even had to close the road up the mountain. Other popular spots like Sand Beach, Thunder Hole, and Jordan Pond were similar. Even on the other side of the island, the popular trails had full parking lots. We packed a lunch and took our chances. We got to see and do everything we wanted to. I recommend taking the shuttle bus if you don't have a large family or kids.","October 10, 2019",Very busy on holiday weekends,151,"Titusville, Florida",5
Acadia National Park,This is a fabulous area which is well worth a visit. There are many tours which can be taken from Bar Harbour depending upon what you want to see. The higher that you go the better the views are.,"October 10, 2019",Marvellous ,339,"Chesterfield, United Kingdom",5
Acadia National Park,"We took a bus tour of Acadia National Park. Our guide was extremely informative and told us the history of Bar Harbour as we went up to the park. She knew all the kinds of trees, plants and animals in and around the park and told us fascinating stories. We took the loop route and ended up at the highest point of the park. It was a clear day and you could literally see forever!!! For those who come by car, there are many excellent walking and cycling routes to take to get to see the park at a closer range. Since we didn't have that much time, a 2 1/2 hour bus tour was an excellent way to get a taste of the park. I would love to go back for a longer period and actually walk some of the trails. This is a place where people of all ages can come and see. It's a true national treasure.","October 9, 2019",A wonderful National park to visit,45,"Beit She'an, Israel",5
