national_park,review_body,review_date,review_title,helpful_vote,user_location,user_rating
Mount Lassen,"Climbed Mount Lassen Peak Trail (along with several hundred, literally, 4,5,6-th graders from Rhonart Park, Sonoma, and other schools). 2000 foot elevation in 2.5 miles. Slope is actually pretty constant from the very beginning. The newly re-constructed trail is wonderful. It is a serious hike, but no climbing is involved. Also hiked into Bumpass Hell from the back - Kings Creek and Cold Boiling Lake. The main trail was supposed to open two days later. Visitor Centers have a lot of good information.","September 23, 2019",Great place for hiking,43,n/a,5
Mount Lassen,"This park seemed to take quite a while to drive to from the Bay area but we were determined to get there to discover this volcanic site. We were not dsiappointed. First stop was the Visitors Center to get our bearings and pick up some literature, learn a bit about the area by viewing a brief movie, and using the restroom before our slow drive through the park. It is truly a beautiful and awasome experience. There are a number of pull-outs to stop and take beautiful pictures. Note that the first stop has a walk trhat takes you past the mud pots and other geologic wonders. Pictures just don't capture all of the beautiful aspects of this park, but they will serve as a wonderful memory to us for all time. Not that many of our L.A. friends even know of this park, and we've been sharing our insights with them and encourage them to go and see for themselves.","September 21, 2019",What a wonderful park!,24,"Thousand Oaks, United States",5
Mount Lassen,"My wife doesn't hike and we are well into our 60s so we took an auto tour beginning at the north entrance. I have a lifetime senior pass for National Parks that got us in at no charge. The scenery is beautiful and I would rate it as good as Yellowstone or Denali if it just had a bunch of big animals like bear, buffalo, and elk. It did impress me more than Yosemite which we visited a few days previous. Lassen is popular but you won't really have to fight the crowds like you do at some other parks. It seems to have all anyone would need for hiking and camping.","September 15, 2019",VERY SCENIC,20,"Natchitoches, Louisiana",5
Mount Lassen,"We didn’t expect to have four seasons in Mt Lassen. It was a great experience for us. We did auto touring through the whole mountain, entered through manzanita lake, exited through Kohm Yah-mah-nee gate. It’s indeed a Pretty scenic, we were surprised with leftover snow on the peak. Be ready with jacket and be ready to spend few days if you want to hike. If you just want to do auto touring, you will need whole full day trip. ","September 3, 2019",Beautiful Nature,4,"San Francisco, California",5
Mount Lassen,"They are not lying about that 2000 some foot rise in 2.5 miles! It's pretty good long hike, I believe that the sign at the bottom said 4 or 5 hours on average but I was able to do the whole thing in about 3.","August 31, 2019",Good physical therapy hike!,35,"West Yellowstone, Montana",5
Mount Lassen,"We hiked up Mount Lassen on July 24. Even then, the trail still had substantial snow. The snow was mostly on the lower third of the trail. And, the trail was well marked across the snow. The views are tremendous from the moment the trail begins. This is only a 5 mile round trip hike but the summit is at 10,457 feet. Another huge bonus: Lassen Volcanic Park is not highly visited. There were definitely other visitors on the trail, but we had the summit all to ourselves. Pretty spectacular!!","August 26, 2019",Loved this hike!,218,"Marietta, Georgia",5
Mount Lassen,"We went up Lassen in early August on a sunny cloudless day. Even with an early start, we knew it was going to be quite warm. There was little shade on the trail. The views were terrific all along the trail as we switchbacked up the mountain. Halfway up, we were greeted with a deluge of orange-&-black tortoiseshell butterflies streaming down the mountainside. At the peak was a vast snowfield. The elevation gain is 2000 feet with a trail length of about 2.5 miles (5 miles round trip), so it is not a very difficult climb. Nevertheless, if you have joint or stamina issues, this may not be the hike for you. All in all, we loved the hike.","August 14, 2019",Lovely views all along the way on a challenging hike,35,Connecticut,5
Mount Lassen,"Great drive through the mountains. Good roads, well kept. Our day took us through sun, rain, hail, sleet, and snow. Fab! Be ready for anything at the beginning of August!","August 10, 2019",Love it,102,"Vancouver, Canada",5
Mount Lassen,"The views are great, but no real interpretive center other than the visitor centers. Everything requires long hikes. Wasn’t all that impressed.","August 9, 2019","Beautiful scenery, not much to do",102,"Benson, Arizona",3
Mount Lassen,"We did the trail up Mount Lassen in a great hot summer day (but not extremely hot) with a light overcast sky. These conditions make the walk perfect: not to warm, not to cold. Was the weather warmer then things could get really hot, really fast, so go prepared with water for everybody! On the other hand at the top of the peak temperatures are much lower than down in the car park so be ready to take some light warm jackets just in case (we did not needed them only because the wind was from the right side... and we were protected by some rocks in the summit). The path follows a steady (and relentless) gentle slope with amazing views all the way up, and breathtaking 360 vistas as the top. Be prepared: there will be some crossings over snow, so adequate shoes is a must), and some sections are near big exposed slopes that may not be enjoyable for people that don't like heights. We visited in august weekday and we met people in the tray but it was not crowded at all, and in the top it was 5 or 6 of us (and the area is spacious).","August 8, 2019","Feels longer than it is, but its just a question of stamina. The prize is great up there!",10,"Porto, Portugal",5
Mount Lassen,"Four of us went to Lassen Volcano National Park for July 4th - 5th. It was fun! Since parts are high elevation we got to throw snowballs and walk in snow on July 4th. Not only were there thermal features (like a mini-Yellowstone), but geology of volcanics including all the various types of volcanoes are present in the park. Unfortunately some of the roads in the park are not connected, meaning you have to enter from different areas to get some places. Due to our time limits we didn't get a chance to see some of those. Also we didn't want to hike on the snow-covered areas, but there was plenty of information about conditions in each area so we knew what to expect. This is a worth a visit, although not as beautiful as the top rated National Parks.","August 6, 2019",Snow on July 4th,17,"Albuquerque, New Mexico",4
Mount Lassen,This national park is amazing and well worth a visit. Mount Lassen is a must to climb. The views are stunning and the swarms of butterflies on the slopes are just incredible. ,"August 6, 2019",Amazing,9,"Bolton Percy, United Kingdom",5
Mount Lassen,"A magical 5 mile round trip hike with 2,000' elevation gain to the summit of nearly 10,500'. We completed it in a little over 4 hours on 7/31/19. Near perfect conditions, cool breeze, minimal snow crossings, not too crowded and thousands of California Tortoiseshell butterflies swirling around the mountaintop for the last mile or so of the trail. It pays to plan a trip around conditions to account for snow, high temperatures and forest fires. Not an easy hike as it is rated difficult in many hiking guides, but we did meet two 80 year olds with pacemakers making the climb although both were experienced hikers. Make sure you hydrate and bring enough fluids.","August 3, 2019",Lassen Peak Trail - Bucket List Worthy,36,"Santa Rosa, California",5
Mount Lassen,"This is the second time I’ve been to Mt. Lassen. Wish I had more time for some hiking, but even a drive through is well worth the time. ","August 2, 2019",Hard to take a bad photo,2,,5
Mount Lassen,"If there is wind or not, stop and enjoy the lake! If there is no wind with sun, you have to stop for a reflection photo. We had great weather and really got some nice photos. Beautiful views! ","July 31, 2019",really nice photos!,125,"Port Orchard, Washington",5
Mount Lassen,"it is the southern most active volcano of the western USA. Elevation is over 10,000 feet.If you are not a hiker, you can enjoy a fantastic drive. Mount Lassen is part of a National Park. $30- entrance fee to the park. The visitor center will provide maps and information regarding the park and suggest what would best meet your personal need/desire.","July 25, 2019",Mount Lassen is stunning...,1133,"Nashville, Tennessee",5
Mount Lassen,"We visited Mt Lassen and had an amazing experience with a hike around Manzanita Lake, great photography available and birdwatching at the lake and surrounding area.","July 23, 2019",Beautiful park with views!,29,"Beirut, Lebanon",5
Mount Lassen,"We visited via the North entrance to Lassen Volcanic National Park. The museum was there but closed in May. Manzanita Lake was so large and pretty and this part of the park was beautiful. We were able to drive in 10 miles to the devastated area. There was a lot of snow there and you had to walk if you wanted to go further. There are 4 types of volcanoes in the park. You can't drive through the park from one end to the other, this time of the year.","July 9, 2019",Beautiful park with an assortment of volcanoes and lakes.,13,"La Mesa, California",4
Mount Lassen,Center of ParkThis monumental plugin volcano gives the park its relevance its trek and its story Amazing ,"July 8, 2019",Active volcano ,32,"Zichron Yaakov, Israel",5
Mount Lassen,"We called the area Mount Lassen for the last 45 years, and learned it's actually Lassen Peak. Fantastic place to visit. Be sure to check ahead if you want to hike. There still is a lot of snow (July 2019)","July 7, 2019",Oops..its actually Lassen Peak.,51,"Yerington, Nevada",5
Mount Lassen,"Had an amazing vacation here over the July 4th week, got in some hiking and kayaking. The employees were all very pleasant and helpful, always ready to answer my questions. Trailheads were not well marked and the snow in the south part of the park kept me from exploring many of the trails I had originally planned on.","July 5, 2019",Beautiful Place,11,"Bend, Oregon",4
Mount Lassen,Due to snow covered roads we were unable to drive thru the park to south side. We made best if it and hike around the lake behind visitor center. It was beautiful walk. The people in visitor center were very helpful with all my questions-they enjoy their job. ,"June 23, 2019",Interesting ,26,"Mount Dora, Florida",4
Mount Lassen,"Given that the eruption occurred over 100 years ago, this majestic mountain remains to welcome lucky visitors. I visited first at age 10 and the return didn't disappoint. The colors are stunning, green grass, white snow, red pine needle paths! There is something at this national park for all ages. The visitor centers are excellent, there are suggested search games for kids, everything is well groomed in the park, and there are choices of small hikes and huge hikes. No regrets in re-visiting!!","June 19, 2019",Lassen is a stately lady that benefits the visitor to see!,187,"Santa Cruz, California",5
Mount Lassen,"This was a special trip to California to see Lassen VNP. We had a great time, despite only being able to go to Destruction Point. We talked to a fascinating couple who had just hiked up Mt. Lassen and skied down. How awesome is that? We will return to LVNP in the future when all roads are open and we have more time to see all 5 volcanic types.","June 18, 2019",We love Lassen Volcanic National Park,38,"Downs, Illinois",5
Mount Lassen,"I've been going to Lassen since I was 8 years old. Our family moved to Northeastern California in 1969. The park is filled with history, which was probably more interesting before 1980. You see, at that time, it was the only volcano that had erupted in the lower 48. When Mt. St. Helens blew up in 1980, people have tended to forget Lassen. That's good if you want less crowding. Most people who visit California's National Parks head to Sequoia and Yosemite. They tend to not want to travel all the way up to Lassen. There are abundant trails, from short to quite long. There are bubbling sulphur works and mud. There is a trail to hike the summit of Mt Lassen. Kings Creek Meadows is beautiful, and the source of the North Fork of the Feather River.","May 31, 2019",Lesser known National Park--shhh!,10,"Lincoln, Nebraska",5
Mount Lassen,"Mount Lassen (10,457') is the centerpiece of Lassen Volcanic National Park. The peak is what remains of a lava dome volcano that erupted several times between 1914 and 1917. It is still considered to be an active volcano, and is closely monitored. The park protects the surrounding geothermal ecosystem and provides educational and recreational opportunities. A spectacular scenic drive (CA89) passes through the park and around the eastern flank of Mount Lassen. The two-lane highway is paved and about 30 miles long, with views of the peaks and alpine lakes along the way. Note that the road is typically closed in the winter (November-May) due to heavy snowfall. A NPS pass or entrance fee is required; $10-30 depending on the time of year and mode of transportation. There are two visitor centers at either end of the park with interesting exhibits and information to help plan your visit. Numerous hiking trails of various lengths and difficulties provide access to the mountain wilderness. We visited in August and the park was not crowded. The landscape was very green and there were many wildflowers blooming. We were traveling with a wheelchair so that limited our activities, but we enjoyed the Sulphur Works geothermal area and the easy trail through the Devastated Area which has interpretive signs about the 1915 eruption.","April 13, 2019",Beautiful Volcanic Wilderness,1781,"Tucson, Arizona",4
Mount Lassen,"The main road wonders through the park over a meandering 28 miles. A full day with frequent stops allows for 3 short hikes. These can be very interesting from a geologic standpoint, or absolutely beautiful if hiking a stream with water falls. Weather in the fall can be cool, but there are no mosquitoes and few crowds. Hiking to the summit is an all day expedition from the south entrance. Only attempt it if you are an experienced mountain climber and have carefully checked the weather. Weather near the summit can change very rapidly. Taking 2 days to explore is really the best way to enjoy this park. Even if not doing a lot of hiking, have good shoes and if going up a steep trail, hiking boots and trecking poles are recommended.","March 22, 2019",A wonderful place to explore in the uncrowded fall,48,"Klamath Falls, Oregon",4
Mount Lassen,Love Lassen because it’s off the beaten path and not crowded. Beautiful hikes and scenery without being ruined by cars and traffic.,"March 15, 2019",Spectacular and very few people!,1,"Novato, California",5
Mount Lassen,The scenic drive over the mountain ridge is one of the best in the USA. Terrific views in all directions and lots of places to stop and take a walk. Take lots of photos and enjoy. This whole area is worth a week of exploring but just a day drive is also well worth it.,"December 30, 2018",What a special place and one of America's great drives.,163,"Everett, Washington",5
Mount Lassen,"I have wanted to go to lassen since I received my first big piece of rainbow obsidian from the lassen volcano area. As a geologist, I have longed to make the trip here and it did not disappoint. Beautiful drive, so many different geological format in in one area. Well worth the visit for anyone. ","November 11, 2018",Finally here,11,"Ellisville, Missouri",5
Mount Lassen,"Ranger told us this is becoming a very popular park. Get here before it becomes over crowded. October was a perfect time for us, very little people. This place is like a mini Yellow Stone. The volcanic mud, steam, & sulfur was amazing.","October 24, 2018",Not Hidden Anymore,241,"Placitas, New Mexico",5
Mount Lassen,"There is a lot packed into this less well known of the National Parks. There are active thermals, history of a volcano eruption that was only 100 years ago, and it is beautiful. We took a short hike around Manzanita lake in its fall colors. Unfortunately we didn't stay long enough to view more, but wish we had.","October 24, 2018","History, Geology, and Beauty",13,"Simpsonville, South Carolina",5
Mount Lassen,Very scenic park . the view is magnificent . very good park for hikers that like to walk into the mountains and enjoy the places ,"October 6, 2018",Best NP in america,9,Israel,5
Mount Lassen,"I’d never heard of Lassen until I was researching our road trip, but so glad we came. We drove in at Lake Manganita and drive through the park - the expected one hour drive actually took the best part of the day. There’s so much to see and it’s very different from other parks because of its volcanic nature. Not to be missed","October 1, 2018",Wonderful National Park,99,"Suffolk, United Kingdom",5
Mount Lassen,"This is an extraordinary place to explore with many waterfalls a lot of hiking trails! There are ample camping sites as well as kayak and cabin rentals near Manzanita Lake. Great fun for the entire family,","September 13, 2018",Quick day trip fun!,11,"Redding, California",5
Mount Lassen,"Despite the neighboring fires all across California, the lassen park was refreshingly clear of smoke. I live that it is not nearly as crowded as Yosemite. The dark sky festival was amazing, a must see. Lassen park has some of the darkest sky in the country, ideal for sky viewing. It gets cold at night, but camping is super fun. Campgrounds are well maintained. Overall, I LOVE Lassen National park. I’ve been here more than a dozen times in the past 4 years and will keep coming back. Also, one of the few active geothermal areas in california, it is the southernmost of the Cascade volcano complexes.","August 8, 2018",Lasen Dark sky festival,5,"New York City, New York",5
Mount Lassen,"It is totally out of the world. I was skeptical to go alone there and after having hardtime finding a group tour, I somehow found a 3 day tour. It is an amazing place to visit and I would highly recommend it as a family destination. However, hiking is not recommended if you are out of shape.","August 1, 2018",Amazing Place to Visit,1,"New Orleans, Louisiana",5
Mount Lassen,"Honestly, I know Mount Lassen has a lot to offer. It is beautiful. I remember going as a teen and hiking the mountain, visiting the devastated area, etc. For some reason, though, on this trip it felt like we were only able to drive to a couple of spots before we had to stop and there wasn't a lot to do. Getting help wasn't easy, either. I was disappointed in how little info was available to help me find my way around. ","July 27, 2018","Beautiful, but confusing",7,"Marysville, California",4
Mount Lassen,"Out of the way, but the drive alone is a quintessential summer road trip. Take your time, slow down and connect.","July 25, 2018",Nature at its Finest!,1,,5
Mount Lassen,"This review is about the hike up Mount Lassen on July 22. I’m 41 and in decent shape.So what’s important-Firstly, the weather-it is much cooler and windier at the top. So ask the ranger, check your weather sources.Do you need hiking boots? Yes, you do. Don’t attempt in sandals.Bring a hat, windbreaker, wear sunscreen as a lot of the trail is exposed to the sun.Carry at least 750-1000 ml of water, snacks etc.What’s the best time? Probably early to late morning-it’s pleasant at the top noon to mid-afternoon temperature wise (60’s) and this will give you enough time to plan ascent/descent.How tough is the trail? I would say strenuous. It’s 2.5 miles but a 2000 feet climb. I did it 2-2.5 hours up and 1-1.5 hours down with a few breaks. Is the trail treacherous? No, not really. But it’s on rock and although it is well kept, there are still pieces of rock, boulders that drop off in the trail. Also, brief stretches of snow. What should you watch out for-climbers that run downhill. I found people who were trying to jog down the most ridiculous. More than putting themselves at risk, they were putting others on the ascent in a tricky spot. Another place to be careful is at the transition of switchbacks-and there are many! Also, the true summit is a further 100 feet from the landing at the top and the trek to that is more difficult. Avoid to be safe, there are the same vistas to be had at the landing.Should a person scared of heights do it? Probably not.I saw numerous wildflowers, gorgeous white-bark pine and Clark’s nutcracker along with tortoiseshell butterflies. The view from the top is stupendous!","July 24, 2018","Enthralling, breathtaking - literally!",22,"Charlottesville, Virginia",5
Mount Lassen,Out of the way but worth the trip. Magnificent vistas and beauty. Lots of very interesting geologic history and volcanic information.,"July 22, 2018",Unexpected Treasure,11,"West Bountiful, Utah",5
Mount Lassen,"When you go through the gate you can go to the gift shop and preview some of the historical facts about Mount Lassen. It is a wonderful and educational experience. I drove from one side Highway 36 entrance all the way through and came out and took Highway 299 to I-5 toward Redding. I wouldn't have missed it for the world. It is a beautiful place to visit. The Volcano is still releasing sulfur and steaming. The lakes, ponds, streams, mountains and streams are noteworthy! The drive is exciting because of the narrow roads and steep hills. You just have to see it for yourself! Do it!","July 9, 2018",Very Interesting and Historic,4,"Wheatland, California",4
Mount Lassen,This park is a gem. Not too crowded. Trails for every level of hiking. We hiked for two days and plan to return to do other hikes. The park has had 4 different types of volcanoes. Very educational. Visitor center is helpful too.,"July 9, 2018",Awesome Hiking experience,17,"Phoenix, Arizona",5
Mount Lassen,"We visited the park, doing the very pretty drive. Some of the best hiking trails were closed - which was disappointing. These included the best trails for seeing thermal activity. I did he hike up to the pea of Mt Lassen which was fantastic. Steady uphill hike. I kept a brisk pace and it took me 1 3/4 hours to get up. I think most hikers took 2-3 hours up and much less coming down. Some slippery, snow-covered areas (June) but mostly a nice trail. The views from the top were fantastic. It was a clear day and Mt Shasta was in the distance. Loved this hike.","July 9, 2018",Beautiful Park - and great hike up the mountain,4,"Durham, North Carolina",4
Mount Lassen,"A great national park to visit! Not crowded! Each hike is a different experience from beautiful wild flower filled meadows (paradise meadows) to boiling lakes ( boiling lake trail), to steep and rocky jumbles ( chaos crags) to leisurely strolls (manzanita lake), to fumaroles and mudpots (right along the main road), to the most amazing stream waterfall we’ve ever seen! (Kings creek). The hike markers on the trails are not exactly true and plan to hike a bit longer then they say but the trails are well marked. Bring TP and lunch as the visitor center is quite a drive from most of the trails. We stayed three days and saw something new every hike. ","July 8, 2018","Diverse, challenging or easy. Lassen has it all!",10,"East Brunswick, New Jersey",5
Mount Lassen,My favorite was Cinder Cone. Mount Lassen itself is not especially awesome-looking. It probably was before it blew up. ,"July 6, 2018",Second-best mountain in the park,603,"Oakland, California",4
Mount Lassen,"Beautiful and peaceful place. Still had over 10' of snow at the pass when we were there in June. Mostly quiet and not crowded, something hard to find in California. The color of the water over the ice on the lakes was amazingly blue and beautiful. Unfortunately there was too much snow to make it all the way up the mountain - it will be for another time. It would be a GREAT ride downhill on a bicycle, another thing to consider doing next time we are here. Worth the drive, worth your time.","July 4, 2018",Oh to see the beautiful designs volcanoes make,324,Canada,4
Mount Lassen,"The significant other and I spent nearly 6 hours in the park on June 19th. The views are breath-taking. We took a couple of short hikes, 1.5 miles and 4 miles, and were rewarded with even more views. Lots of interpretive boards are provided. The nice thing about this park is the lack of noisy, pushy crowds. Take some some to relax and truly experience Lassen Volcanic National Park.","June 20, 2018",So Much to See and Do!,95,"Mesa, Arizona",5
Mount Lassen,The drive through Lessen Volcanic National Park is beautiful and peaceful. Amazing views everywhere you look and places to stop so you can get an even better view.I was there in mid June and there was still enough snow to have a snowball fight and Lake Helen and Emerald Lake were still frozen.,"June 19, 2018",Peaceful Drive,40,Missouri,5
Mount Lassen,Spent 8 day camping at Manzanita Lake Campground inside of Lassen National Park. Campground was very nice and quite. We did several days for hiking in the park and had a great time. We downloaded the auto tour before leaving home and that was a great way to do the 30 mile trip through the park.,"June 18, 2018",Very interesting area,27,California,5
