national_park,review_body,review_date,review_title,helpful_vote,user_location,user_rating
Mount Lassen,"How do you hide a mountain, or should I say an active volcano. It is really not well known even in California, being near no major freeway. When we take people up the winding road of Highway 32 (off Hwy 99 at Chico), you drive some 45 miles of scenic wilderness delight to left on Highway 36 (PS have a full gas tank in Chico and get a picnic lunch), then another 20 minutes to the entrance of the Park, then you really learn what the words ""winding road"" means once inside the park. But every turn just gets better and better.Geologically Mount Lassen is at the end of the Cascade range and on the way up Highways 32 and 36 as I described you wind in and out of the Cascade and the start of the Sierra Nevada range. That is a delightful trip in itself with creeks and dramatic views sprinkled throughout.Once in the park you will run into breath taking views that remind me of Zermatt Switzerland except for the numerous hot springs, volcanic vents, mud pots and even green boiling lakes that thunder under your feet. The Alpine heights are unbelievable. For the moderately fit you can even climb to the top of Lassen for a view that will knock your socks off. Coming the route I described you will go through the Main entrance that has a brand new interpretive center that is worth a orientation visit, then head up to Bumpass Hell, various other hot spots and views that have easy parking. For those who want to get away from the crowds go to the small town of Chester, head towards Drakesbad to reach a little used entrance to the park. There you can see Devils Kitchen or another route to cold boiling lakes that make you think your on a set for a David Bowie Space video the landscape is so alien as the ground shakes under your feet. Bring plenty of water and lunch folks for these hikes.Lots of car camping to rugged hiker camping - you get a pretty good map when you enter into the park. Limited services at Main Entrance but more full service, camp store at Manzanita Lake when you almost complete the drive.This is backpacking heaven for the fit- I have taken many scout groups on a Lassen to Lassen Hike from the top of Mount Lassen to Butte Meadows Camp Lassen 60 miles way. If you study the maps you can hit many major areas from various entrance points with a all wheel drive vehicle highly suggested, a little hiking, not be with the crowd and be busy for a week or more.Oh and be ready to speak German, they just love this park.","February 14, 2014",A Hidden Worldwide Attraction in Northern California,199,"Chico, California",5
Mount Lassen,"I hiked Mt. Lassen in mid-October, just before the trail was closed for the winter and couldn't have picked a better time. At the southern end of the Cascade Range, the 10,457 ft peak was the last to erupt in California in May, 1915. It has unimpeded views to Mt. Shasta, 70+ miles NW and the Sierra Nevada, 125 miles SE. The small amount of snow on the ground (little on exposed ground, 4' in drifts) only added to the beauty of the hike. The snow capped peaks and sapphire lakes in all directions shown in the crystal air. The entire park, and surrounding country, are a jumble of forested slopes and shadowed valleys.Notes: The trail is well tended and good for all until just below the peak, but it would be exposed, hot and dry in the summer, With snow, trekking poles would be helpful.","December 29, 2013",Last active volcano in California offers magnificent vistas,24,California,5
Mount Lassen,"We had a great day out at Lassen Volcanic National Park. It is a bit off the beaten track and we didn't find a cafe open in the park when we visited in october, so make sure you have food and drink with you. We did the car trail rather than the hiking trails and saw some lovely things, including the fantastic view from the top of mount lassen. Recommended for views and that feeling of being in the 'big country'.","November 3, 2013","Great day out, bring food with you!",27,"Bidford-on-Avon, United Kingdom",4
Mount Lassen,Hikes that the whole family can enjoy with beautiful views. Small piles of snow still were evident even in July near the top of the mountain trail.,"October 28, 2013",Incredible Hikes,29,"South-Central, PA",5
Mount Lassen,"You’ll find the miniature version in Lassen. Some mud holes, some peaks, some lakes. You won’t find an Old Faithfull, but the magnificent hiking trails are even more beautiful. A very nice, small park. Good for a day’s visit or even more if you like hiking.","October 26, 2013",If you missed Yellowstone ......,41,"Spijkenisse, The Netherlands",4
Mount Lassen,"My husband and I visited Lassen VNP this past May. We happened to be there the weekend of Memorial Day and because of lower snowfall amounts this past winter, they were able to open the park for weekend travelers. I have to admit I wasn't so sure that I wanted to take the time to make a stop since it was a little bit out of the way to go there but my husband was insistent that we go and I am so glad that he was! This park had so much more to offer than I ever imagined. We just did a drive through but took our time to walk around (there are some very easy educational walks on paved surfaces). The mountain was beautiful...some of the lakes were still frozen but beautiful. This may have been a lower snow total year but there was still plenty of it at the end of May! I can't say how much I enjoyed our stop here and am so glad that we took the time to do it!","October 23, 2013",Lassen Volcanic National Park....A Pleasant Surprise,297,"Niles, Ohio",5
Mount Lassen,We were there for 4 days. There were so many hikes you can go on no matter what level of hiking you are at. I was surprised that there were mud pools and hot springs like what you seen at Yellowstone. When we were there the sky was so clear and you could see what seemed forever. The hike to Bumpass Hell was worth the 3 miles. They were just starting to shut down campgrounds for the season so we were limited as to where we could stay. It was the South something campground. North was closed. The spaces are small and asphalt is in bad shape. On our last day we hiked the Manzanita Lake trail. Make sure to start the trail behind the museum. The trail is better defined there. We went a different direction near the boat ramp and it was hard to follow at times. We stayed close to the water and found our way back to the main trail. I took some amazing pictures of the mtn with the lake and water fowl. It was only 10.00 to get into the park for a week. We want to go back but take our motorcycle next time because the views are so amazing. Also many more hikes we didn't have time to do. This was a GEM,"October 11, 2013",Spectacular Views,21,"Medford, Oregon",5
Mount Lassen,"My family went camping at Lassen VNP at the first week of August. We enjoyed the scenic volcanic view, several beautiful lakes and the not too hot weather. We arrived a Friday afternoon and the Manzanita Lake camp site was full. We moved on to the next camp site - Crags Camp. We found a good spot under the trees. Cool at night. Make sure you bring your jacket. Comparing to Yosemite, the highway to Lassen VNP is straight and flat.Day 1: Arrived Crags Camp and set up tent.Day 2: Drove outside Lassen VNP. Visited Subway Cave at Lassen National Forest (15 min drive from Lassen, a easy flat highway). Then drove another 30 min to McArthur Burney Falls (also a easy flat highway) a must see, very beautiful water falls. We had a picture lunch there and enjoyed the falls for a while. Next, we drove back to Lassen and did the trail of Manzanita Lake at Lassen VNP about 1 hour to go around the lake. We did not do the kayak because we arrived after 3pm. But I highly recommend to do kayaking in the lake if you have the time. Then we took a shower at Manzanita store. Great hot shower. Bring more quarters. The store has everything you need. Stayed at Crags camp site the second night. Day 3: We drove from north of LassenVNP to the south. Stopped a several view points to take pictures. Not crowded. We saw many lakes in different areas. Very peaceful views. Finally we were there, the highlight of the trip - Bumpass Hell. 1.5 hour round trip hike. Rough ground. Beautifull mountain/lake view. Lots of purple wild flowers. The day was not too hot. we felt very comfortable. My 9 yr old did not feel difficult.I did research at TripAdvisor to plan this weekend getaway trip. We went so many beautiful places in a fairly short trip. What else can you ask for??","October 1, 2013",A Great Summer Camping Trip,29,"San Mateo, California",5
Mount Lassen,"Loved this park, the scenery is stunning. We did the 30 mile drive and hike to Bumpass Hell. There is mountain scenery, sapphire blue lakes, and the drama of all the bubbling mud pools and smoking sulphur rocks. Worth a trip.","September 28, 2013",Stunning... Include it in your itinerary if you have time,54,wirral,5
Mount Lassen,"We traveled in our RV, staying at Hat Creek for 5 days while we explored the park and general area. The Pacific Crest Trail was just above out campsite and so we did 2 different day hikes in opposite directions that totaled about 10 miles of very easy trekking for us ( we're in our 60s). We visited Lassen Volcanic Park several different days and each time saw it in a new way depending on the time of day as well as entering the park from different entrances. It was a beautiful park to view. We also traveled outside the park on some of the byways, and found much pleasure in viewing the countryside and its changes with elevation, not to mention some of the small towns we encountered. It was a memorable week of our trip northward!","September 24, 2013",The Scenic Volcanic Highway - Northern California,2,"Atwater, California",5
Mount Lassen,"Road trip with easy access off highway 44 between Redding CA and Reno NV. Park offers numerous exhibits, trails and off highway stops for long and short roaming. Late summer in September offers for perfect weather potential. Make sure to stop at visitors center both north and south entrance.","September 22, 2013",Easy day trip,40,Big Bear City,5
Mount Lassen,"They have really done a great job in Lassen Park. Lot of turnouts. Nice interpretative trails. Good hiking. Nice visitors center. Good roads. Overall, one of my favorite parks. But you do need to be interested in volcanic geology to really get the most out of it. But the many spectacular views will please most everyone.","September 21, 2013",One of our National Treasures,242,"Jacksonville, Florida",5
Mount Lassen,"Highly recommend that you drive the entire 33+ miles through the entire park so you can enjoy multiple views and perspectives of Mount Lassen. If you plan to hike, you should allow 4-5 hours and the path is very steep. We did not hike it, but the parking lot is 8500 feet and the highest point in the park.","September 19, 2013",Great National Park,83,"Seaside, California",5
Mount Lassen,"Lassen Volcanic Park is just something out of this world. About an hour from Redding, it is worth the drive to see this beautiful national park. There are lakes, steam vents, waterfalls and sulphur pits in the same park! there is one particular lake in the middle of the park that has crystal clear water with a beautiful mountain range backdrop. Not really for swimming as the water is very cold, but just beautiful to dip your feet in. The sulphur works area has a boiling sulphur pit right on the side of the road. What a stench, but well worth the drive to see in person. A must see attraction in the Redding area.","September 3, 2013",Wow!,49,California,5
Mount Lassen,"Did a 3.5 hour drive out there from El Dorado Hills and it was worth every mile and hour we spent on the road. Once you get off the I5 near Red Bluff the scenery starts to change as you climb up to the park. It's just magnificent. We got to the park around 9 am, had something to eat and drink in the visitor center then took the drive along route 89 that winds through the park. You can stop at various highlights along the way like the Sulfur Works where you get that rotten egg smell near the boiling mud, tons of fun ! We toured around for about 4 hours until we reached the North exit then drove back. I recommend that if you decide to drive through you should invest $6 on the road guide as it has a lot of great information on all the sites you will see and where to stop. Take some sandwiches and drinks for the way and stop at Kings Creek for a little picnic lunch. All in all it's an impressive place and if you are within driving distance then don't miss it.","September 3, 2013",A Great Day Out,134,"Meitar, Israel",5
Mount Lassen,"I cannot believe that this gem is only 4+ hours from the Bay Area, and hardly gets any recognition from any hikers or backpackers/campers.It was super easy to get to from freeway 505 and connecting to either 89 or 44.The roads inside the park is very clean and beautiful. Rangers and employees were super friendly and helpful.There are lots trails ranging from easy to hard for everyone.Tons of lakes and streams, a couple of beautiful waterfalls. What else can anyone ask for from a national park. Yet Yosemite and Mammoth took all the glory.We hiked Bumpass hell and that was fun but a lot of work going back up from hell :)Manzanita lake was very nice, as were Helen's lake and Emerald lake.We did not do King's waterfall and Lassen Summit, and hopefully will do it on the next visit.","September 3, 2013","Clean, easy access, trails for all levels",64,"Danville, California",5
Mount Lassen,"It is clear Lassen Volcanic National Park is a well kept secret. It is only three hours from Yosemite, yet gets only about 10% of the annual visitation. The park is clean and well maintained with markers and features to keep adults, and children alike engaged in its features. The new Kohm-Yah-mah-nee Visitor Center is easily one of the nicest in the NPS system with an information desk, auditorium (and cool park film), book store, cafe', and outdoor seating area. The thermal features of the park are easily visited in a day, however, we choose to stay at the Drakesbad Guest Ranch and make a week of it exploring all five regions of the park. This was easily one of the most relaxing and interesting parks were have visited to date.","September 2, 2013",Gem of a National Park,65,"Torrance, California",5
Mount Lassen,"We entered the park from the southwest entrance off 89 and immediately stopped at the visitor center. Lots of info and educational panels, clean restrooms and a gift shop to browse through. The road through the park is twisty and the views beautiful. We passed steam vents, tons of rocks of all sizes and shapes, sandy dune looking areas and crystal clear sparkling lakes. Great ride on a motorcycle! Also stopped at the Loomis Museum (interesting) to take a walk down to the lake areas. Would love to spend more time in the park.","September 2, 2013","Lovely lakes, jumbled rocks, crazy landscape",151,"Palatka, FL",4
Mount Lassen,"A multi-year project to improve the trail is restricting when you can climb this mountain, but the trail is going to be very nice when they complete it. The views from the top are superb and it's well worth the time to climb it. Don't shortcut! The park service is threatening to close the trail to individuals.","September 2, 2013",Terrific view,10,"Patterson, California",5
Mount Lassen,"This is the least visited National Park and I have no idea why. It is a beautiful park to drive through or hike. We had planned on doing some serious hiking in the park but a leg injury prevented us. Just driving through and seeing Kings Creek, the Sulphur Works, Emerald Lake and stunning Lake Helen was worth the time and money. There are plenty of turn outs and vista points as you make your way up to the edge of the caldera. Beautiful! We will be back to hike it, that's for sure.","September 1, 2013",Really stellar!,100,San Diego,5
Mount Lassen,"I last visited Lassen 55 years ago and it remains one of the most memorable and impressive National Parks I have visited. The hiking trails have several levels of difficulty but most from the southern entrance are doable by beginners (or seniors). The road from the southern entrance takes a route around Mt. Lassen with wonderful views from many vantage points. Unfortunately, to visit the lava fields the Northeast entrance must be used which requires leaving the park and driving a considerable distance. It would make sense to camp or stay near the Northwest entrance (in Redding, for instance) to see all of the park sights over several days.","September 1, 2013",Long Distances but Spectacular,31,"Toronto, Canada",5
Mount Lassen,"Excellent dome to hike up. A decent elevation gain on the trail, which distance wise is relatively short. You are also not able to hike up anytime. You need to make sure it is open when you go. They let people hike up part of the way, and you still get great views. But make sure you take water, and snacks, and a jacket, as the weather can change quite drastically. Fun though, with nice rocks.","August 31, 2013","Nice trail, barren landscape, moon-like",26,"Alameda, California",5
Mount Lassen,"Great park! Very cheap to get in ($10 per vehicle?) and enough to see. We visited in high season, august, and therefore didn't take the hike trails.. but drove around in our car due to the hot weather outside. The ride was very scenic as the landscape seemed to change every 10 min. Unfortunately we almost ran out of gas..so we couldn't see the whole park..(be sure to fill up your tank before entering..","August 31, 2013",So much to see!,12,"Den Haag, Nederland",4
Mount Lassen,"We visited Mount Lassen this summer - a place I went with my family a number of times as I was growing up. As a National Park, it has much to offer to folks of all ages and abilities, allowing for a deeper understanding of volcanoes and hydrothermal activity.With a variety of ecosystems, forests and climates, this is a place that one can explore for days. The visitor center is a great place to start and you can even see actual photographs of Lassen's exploding (quite an amazing feet for the turn of the last century). There are the Sulphur Works and the Devastation Trail for a close up, self guided tour that is easy enough for everyone and wheelchair accessible. If you love to hike, Bumpass Hell Trail is not to be missed - the hydrothermal experience is amazing. Lakes Helen and Emerald are beautiful, clear and cool. My husband and I had just spent a few days in and around Yosemite before we made out way to Mount Lassen and all he could talk about was how much he wished we would have passed on Yosemite to have more time at Lassen (it was the midst of summer and there were just too many people).","August 27, 2013",Nature at it's Best,293,"Long Beach, California",5
Mount Lassen,"We had never heard of this National Park before and it is a wonder. All 4 types of volcanic cones, mud pots, fumaroles, and beautiful hikes to lovely lakes and views. The south west entrance to the park has the best views (and scary roads with no guard rails). The volcanic features can best be seen on the Bumpas Hell trail, bring water as it is a hike. The main road in the park takes you to lakes at the NW end. This is a hikers paradise. You can climb a volcano, hike to waterfalls, see great views everywhere. Accommodations are very limited, camping is best. The park has lots of camp grounds.","August 25, 2013",Wow,38,"Rochester, New York",5
Mount Lassen,"The park exceeded our expectations in every way. Beautiful scenery, great hiking trails, unparalleled views, stinkpots and boiling mud. Forests and lakes were just great. We bought carry out sandwiches at the South entrance visitors center and ate lunch on the shores of Lake Helen, right after a great hike (1.6 mi each way) to Bumpass Hell. Still managed to throw a few snowballs - even in the middle of July. The trail to the top of Mt Lassen is not currently open as it's being renovated. You can walk part way to the top. Great overall experience without fighting off hordes of other tourists. Recommended for all except very young children who wouldn't like to hike.","August 23, 2013",Fantastic Summer trip,27,Central Illinois,5
Mount Lassen,"The walking trail up Mount Lassen was essentially closed the day we went due to ongoing maintenance and improvements crews were doing up there. The parking lot only had 6 or 7 cars out of a possible probably 120 spots. One could climb about a mile before the closure if one chooses. Still one could take photographs from the base. Because of this closure, the parking lot at the head of the trail to Bumpass Hell which is nearby was all full with cars circling around trying to find a spot. The lesson is check the dates in which the walking trail up to the top of Mount Lassen is open.","August 17, 2013",can't climb mountain due to maintenance & improvements,35,"Houston, Texas",2
Mount Lassen,"We drove through Mount Lassen during our recent trip to Redding and really enjoyed seeing the park, its history and the volcanic activity that happened in the park. We definitely would like to return and do more exploration when we have the time.","August 11, 2013",Lovely park with nice views,242,"Carmel, Indiana",4
Mount Lassen,"I have been to this park many times since I moved to Reno 2 1/2 yrs ago. It is only 2.5 hours away and is it ever worth it. It is amazingly beautiful and full of volcanic activity from steam vents, mud pots and fumaroles, to cinder cone volcanoes and lava flows. There are beautiful lakes, great camp sites and lots of hiking trails. It is truly a spectacular place to visit.","August 8, 2013",One of Our Most Beautiful National Parks,47,"Reno, Nevada",5
Mount Lassen,"It just doesn't get any better than Lassen Park when it comes to hiking trails, picnic spots and scenic drives.","August 5, 2013",Panoramic views,19,"Chico, California",5
Mount Lassen,"This was the second time my family and I had been to Mount Lasson. There are lots go different hikes ranging from easy to strenuous. We did the hike to Bumpass He'll. it was well work the effort to see the funerals and bubbling muck. The park has camping, stores museums and spectacular views. We are planning to come back every year.","August 5, 2013",Great hiking and Beautiful views,7,"Sacramento, California",5
Mount Lassen,"As California residents, we've driven by Mt. Lassen on I-5 many times. We finally made the decision to drive the 45 minutes off I-5 to the park and have no regrets, It was well worth the drive and the ""lost"" day on our drive north to Canada. After a one-hour stop at the visitor center (Recommend the 30 minute movie), we drove on to the Bumpass Hell trail and hiked the 1.5 miles (3.0 miles RT) into the largest concentration of hydrothermal features in the park. Bumpass Hell was named after an early settler who severly burned a leg after falling into a boiling pool. The active area is a wide basin filled with various steaming pools and unusual multi-colored soils, stained by sulphur and other minerals. Further into the park we did the 1.5 mile RT hike to Cold Boiling lake where natural gas bubbles up through the lake waters. This is an easy walk and a beautiful lake, but not what I'd consider a spectacle. The gas bubbles could almost be overlooked if one didn't know about them in advance.I had always considered Lassen to be the lone volcano in the park. We learned that Lassen Park has 21 ancient volcanoes of four different types. Our limited time allowed us only to visit the southern half of the park, but we'll definitely return. One cannot help walk away from Lassen Park without feeling awestruck by the unpredictable natural forces of our living planet.If you plan to visit, always check weather conditions and be prepared for anything. The weather can change at any time, as you are up at the 8,500' elevation. Also, if you plan to hike...even the well-used trail, bring water, snacks and plan to arrive back at your car well before dark. And do walk cautiously. Trails can have unexpected tripping obstacles...irregular boulders, tree roots and loose gravel. Its better to walk out than have to be carried. :-) Enjoy!!","August 3, 2013",Wonderful Discovery,33,"San Francisco, California",5
Mount Lassen,"I've been to several National Parks here in the US, but this is not my favorite one. For some reason, it lacked the oooohsss and ahhhhsssss I was looking forward to that usually come when I see something majestic, grandiose and spectacular. Don't get me wrong, the park is pretty, but for me visiting once is enough. Seeing the mudpots and steam vents of Bumpass Hell was I guess the highlight and main attraction of Lassen, that's it! Bring lots of water and wear comfortable shoes if you decide to hike the park.","July 25, 2013",Nice retreat in California,64,"Vacaville, California",3
Mount Lassen,"Near the peak are Bumpass Hell trail and literally around the corner is Helen Lake. It takes a bit of courage to ease into the icy cold water. Bring googles to get breathtaking views under the crystal clear snowmelt. We got all the way in (eventually) and swam ever so briefly. It is much too cold to qualify as ""enjoyable"" but with teens it was a rite of passage to do a polar bear swim in JULY. This was our highlight of Mount Lassen that rated higher than the snow ball fight further uphill. The parking lot is ample, pit toilet in roomy cinderblock building, nice picnic tables on overlook near parking. Steep path to shore from picnic tables, wear shoes until at water edge. Pick your way through the rocks underwater. I wore rubber sandals. It gets suddenly deep about 20 feet out and much colder.","July 18, 2013",Helen Lake - Polar Swim - Snowmelt - Crystal Clear,61,"Livermore, California",4
