national_park,review_body,review_date,review_title,helpful_vote,user_location,user_rating
Sequoia National Park,"Sequoia National Park was a humbling experience. The massive sequoia trees are breathtaking, but besides their physical beauty, they compel you to reflect on the brevity of life. The General Sherman was a seedling sometime between 700 BC - 300 BC. You’re literally walking around living things that were around when Ancient Greek philosophers and ancient Babylonian kings were alive. Our lives are nothing more than blinks compared to the lifespans of these giants.  ","October 17, 2019",An American Must-See,0,"Glendale, California",5
Sequoia National Park,We were absolutely wowed by this national park. Easy to navigate with safe roads. Staff were friendly helpful and informative. We followed one road that took us to most of the highlights. It wasn’t busy at all. We got to see a shy bear too! We did Yosemite the next day but enjoyed sequoia much more with Moro Rock being the highlight. The roads were much better and less busy although there are different things to see. ,"October 11, 2019",Enjoyed much more than Yosemite ,141,"Southampton, United Kingdom",5
Sequoia National Park,"Sequoia National park may not Be as Famous as Yosemite But Has Just as many Scenic views , Mighty Redwoods and Major Rivers .. Sequoia is actually the hidden Gem of the Parks .. As much Pure Nature with only a fraction of the people and cars.","October 10, 2019",As Good as Yosemite National park,14,,5
Sequoia National Park,Nothing beats the serenity of sitting in the middle of giant sequoias. What an outstanding national park. We are so lucky that it has been preserved for all of us. Be sure to visit!,"October 6, 2019",GORGEOUS!,95,"Las Cruces, New Mexico, United States",5
Sequoia National Park,If you are in the area this park is not to be missed. The age and size of these trees is a sight to be seen.,"October 6, 2019",Natural Wonders,53,"West Des Moines, Iowa",5
Sequoia National Park,We spent a day in Sequoia national park and a day in Kings Canyon. Absolutely beautiful- walked by the river in Kings canyon and drive the scenic byway. Dramatic and beautiful the sequoias are amazing.,"October 3, 2019",Fantastic,42,"Croydon, United Kingdom",5
Sequoia National Park,"Beautiful hiking, huge trees, and even a bear sighting! Sequoia is my favorite national park near the LA area!","September 30, 2019",Escape from the city,14,"Thousand Oaks, California",5
Sequoia National Park,Went here today after a 4 and a half hour drive and it was worth it. Got to see several Sequoia including the General Sherman tree which was worth seeing.,"September 26, 2019",Great to Visit,206,"Houston, Texas",4
Sequoia National Park,Not suitable for large Motor Homes or RV .Very few pull through spots . Roads are narrow and difficult to navigate in a 40ft bus.Flushing toilets . No showers on site .Great location for star gazing . Dogs are allowed in the park but only anywhere your car is allowed per park ranger . Troll complained about our Bully dog in parking lot the rangers were nice and explained the rules..... to the old troll .,"September 21, 2019",Azalea campground,7,"Oklahoma City, Oklahoma",3
Sequoia National Park,This place is stunning. Bigger than we’d imagined. Go see it for yourselves. You won’t be disappointed. The kids loved the trees & the waterfalls. The air was pretty thin around the Sherman tree trail so we were all out of breath even considering we are a young fit & healthy family. ,"September 21, 2019",Lovely day out,7,"Norwich, United Kingdom",4
Sequoia National Park,Touring this park isjust relaxing. Need to pick your time when to come. It is very congested during holidays. We have came then and thru middle of week. Very different.,"September 3, 2019",Want to feel small,3,"Brandon, Mississippi",5
Sequoia National Park,"Fabulous visit to Sequoia National Forest. Bucket list accomplishment to meet General Sherman, the world's largest tree. The Park was crowded, so parking was tricky and trails harder to access, but the shuttles make it all a bit easier. A scenic drive and great views.","September 3, 2019",World's Largest Tree,1,,5
Sequoia National Park,One of the most amazing places I have ever been to. It’s a must visit place for all of the family. Take few days because this place is huge.,"September 1, 2019",Amazing ,4,"Los Angeles, California",5
Sequoia National Park,"This forest is beautiful and cooler as you go up the mountains-literally with the temperature and the view too. The road is very curvy, and I was slightly car sick while we went through, but it was such a unique experience. The trees were huge and the views were amazing. Skip the Giant Tree Museum. The trees are giant, the museum is TINY and just explains why they changed the way they thought saving trees and using fire to help. The parking at the museum was hard to find. I would go to a different spot to park and then use the free shuttles to get around. ","August 26, 2019","Winding roads, pretty trees",6,,4
Sequoia National Park,"Take your time to spend a day in this park and enjoy the may different views, the nice temperature (much shadow) and of course the giant trees. Must visit when you’re in the area","August 21, 2019",Must visit,15,"Amsterdam, The Netherlands",5
Sequoia National Park,An amazingly beautiful place. Trees are magical. Nice walks through the forest and great sightseeing spots.,"August 20, 2019",Beautiful ,3,"Trim, Ireland",5
Sequoia National Park,"Sequoia park has the biggest Sequoia trees in the world. Up to i325 feet high, and many as old as 3000 years. Easy to see, and very good accommodations inside the park. West side of the Sierra Mountains, easy access from Fresno, California.","August 20, 2019",Big trees,51,"Scottsdale, Arizona",5
Sequoia National Park,"Exquisite Day in gorgeous surroundings. Our family got to the Park early (8a) and it was quiet and GORGEOUS!!!!! When we left at 3p the line was a mile long to get in, also all the parking lots were full. So GO EARLY. General Sherman (world's largest tree) is worth the trip. we will return in ""off"" season.","August 19, 2019",Gorgeous Park,9,,5
Sequoia National Park,"We were beyond impressed with the beauty, splendor, and accessibility of the park. The ranger talk was most informative and dramatically presented! The trees are beyond awesomeness. Beautiful Beautiful Beautiful ","August 11, 2019",Phenomenal ,92,"Clyde, Texas",5
Sequoia National Park,Adjectives don’t do justice to this park! We went two days. The first night we were there to experience the night sky which was literally breathtaking and we came back the next morning and planned on sending 4 hours in the park but spent 6 because we wanted to see more and more. We should have allowed more time but we did this as a day trip while visiting family in Mission Viejo. We had a nice lunch from the grocery at Lodgepole. And we shopped in the visitors centers. The sequoias are awe inspiring. You know they are going to be towering but just to be there seeing them is fantastic!,"August 9, 2019",The best part of our vacation!,8,"Virginia Beach, Virginia",5
Sequoia National Park,Family Vacation with my adult children... so Breathtaking & unbelievably beautiful nothing like I have ever seen before!!,"August 7, 2019",Vacation,1,New Orleans,5
Sequoia National Park,"Firstly, to see the sequoias you have to go to the top of the mountain. I've been there in December and it was pretty cold at that time. Be also prepared to be dizzy and nauseous. There are many curves until the top of the mountain. Going up was not a problem, but when we return... hoo gosh, my mother and I were very sick. In the bottom of the mountain there is an AMAZING restaurant and hotel. I suggest to stop by there to order a cup of soup and a hot tea to recover from the trip. And enjoy the beautiful view from the restaurant!","August 6, 2019",Sequoia park,11,"Madison, Wisconsin",5
Sequoia National Park,The park is beautiful and serene. There is a sense of peace as you walk among these majestic trees. It was awe-inspiring!What I didn't enjoy about it was the trip into the park! I am terrified of heights and didn't realize we would be so high up. The road leading in and out was only two lanes and it was very narrow and curvy. ,"August 5, 2019",Beautiful and Majestic!!,9,,4
Sequoia National Park,Excellent trip to this park. Free shuttles to take you to the various sites but you can walk a lot of it so you get a real feel for the size of the trees and the beautiful scenery. Highlights were the Sherman tree and Moro rock. Make sure you aren’t scared of narrow paths and heights for the latter!Driving into the park from the south is also ‘fun’. Be prepared for a long drive. It is only 20 miles or so but takes 90 minutes as the road twists and turns and you can only go at about 15 mph!,"July 26, 2019",Must be seen to be believed!,5,East Grinstead,5
Sequoia National Park,"I took the V-Line ($10 one-way) and got the stop at Fresno state (in the little cul-de-sac) very early in the morning. I had a good wait before the Sequoia shuttle in Visalia ($20 roundtrip) was due to arrive. Most everything in the town was closed. But there is an Arby's within walking of the depot that is within walking distance that you can go to. The actual park was wonderful. The forest is magnificent. Much quieter than Yosemite (which would seem like Disney World in crowd size by comparison) and you are actually walking through the trees, rather than the cliff-hugging paths I did at Yosemite.I highly recommend you buy a trail map because there are no trail maps/you-are-here signs once in the wood. I got lost. Not stepping off the path, just one trail turning into another and not knowing how to get back, or even out of the park. Some kind folks with a map helped me.The view from Moro was wonderful. I'm glad I did that first, as those stairs are no joke, and I might not have had the energy after all the walking through the forest.But lovely spot, definitely recommend everyone have a go!","July 11, 2019",Wonderful (but easy to get lost),17,NYC,5
Sequoia National Park,"The most incredible experience. Pictures do not communicate the true size of these majestic trees. There are no words to describe the experience. Definitely a must see. Only one complaint: toilets at the visitor center are ""at their best"" filthy. ","July 10, 2019",A place out of this world,101,"Naples, Italy",5
Sequoia National Park,"You will see the largest living organism on earth, the Sherman Tree. Countless Giant Sequoias, priceless Sierra Nevada views and breath taking vistas anywhere you go. Visit!","July 4, 2019",A phenomenal National Park,15,,5
Sequoia National Park,Don’t skip the giants! It’s a windy road but a splendid trip. The scenery along the way is awesome!!,"July 4, 2019",Absolute Splendor,2,,5
Sequoia National Park,"There is a certain wonder when you visit redwood trees that are over 2,000 years old. You will never forget it and there are a couple of museums along the way to give you information. The visitor center is usually busy, but the staff is always friendly and helpful regardless of your needs. During summer months be prepared for crowds and some parking issues, and keep in mind people come here from around the world. Well worth your time to make family memories.","July 2, 2019",Majestic Beauty,1,"Visalia, California",5
Sequoia National Park,One of the most beautiful and serene places left in the US. Largest trees to be found here in California. No better place to visit other than Yosemite which is accessible from this park also. Only a few miles from our city and worth many trips to visit. No forest to compare anywhere. A special place to go for peaceful surroundings and a beautiful reminder of how fortunate we are to live here.,"July 2, 2019",Sequoia National Park,0,"Visalia, California",5
Sequoia National Park,"Wasn’t sure what it was but once we drove in to the park it was very peaceful. The drive, while curvy, was beautiful with scenery that is unrivaled in other parks. Lots to do from hiking to museums , maybe seeing animals. Spend a day or a week","June 29, 2019",Good vives,137,,5
Sequoia National Park,We had several walks along the giant trees and learned a lot on their existence. Friendly rangers and frequent shuttle buses.,"June 26, 2019",Splendid trees and views.,0,,5
Sequoia National Park,Great beers and nice happy hour food offerings as well as discounts on custom brews. Definitely a site I’ll visit again. ,"June 19, 2019",Great beers,12,"Evansville, Indiana",5
Sequoia National Park,"I drove through the park to see the beautiful landscape and trees but was amazed with the great hiking opportunities. I skipped the touristy spots such as General Sherman and Tunnel log and glad I did. I hiked Moro rock, tokopah, and a couple of smaller hikes on a day trip through the park. There was still snow on the ground and lots of rapids from the snow melt. There was great energy in this park. Also had a really good meal at the Longipole grill.","June 17, 2019",Beautiful and Educational,104,"San Diego, California",5
Sequoia National Park,Sequoia and Kings Canyon are stunning and do different from each other. Make sure to make a trip to Hume Lake! Would 100% go back!,"June 14, 2019",I love this place,21,"Brisbane, Australia",5
Sequoia National Park,Very good air and o so relaxing. Huge and very old trees. Special place to visit. The atmosphere is overwhelming and goves you a very good feeling ,"June 11, 2019",Fantastic Park,3,"Wijchen, The Netherlands",5
Sequoia National Park,"Trees so spectacular, so alive & strong. Big, tall beautiful treesCamp sites, peaceful, well kept, surprisingly empty, and vast. Everywhere was vast. Had wonderful time i n just a couple of days. Can only recommend this as the perfect get away for any camper","June 4, 2019","Beyond amazing, sublime, glorious bliss",5,"Oxford, United Kingdom",5
Sequoia National Park,"We have visited many national parks, but this one was one of the best. There were fewer crowds, reasonably priced camp grounds, and spectacular trees and views.","June 4, 2019",Best National Park Experience,7,"Hudson, Colorado",5
Sequoia National Park,"Visited the park on 5/30. We stayed in Visalia which was about 1.5 hrs away from where general Sherman was located. There is lodging in Three Rivers, but you’re still 1 hr away from general Sherman. It’s really preference as to where you want to stay, but we enjoyed staying in Visalia which had various restaurants and other places to visit. There is a fee to enter the sequoia national park. For a single standard vehicle it was $35 . You can pay at the gate or buy it online and just show the ranger your mobile device, which is what we did. There are plenty of places to stop and take pictures, so make sure your cameras are fully charged and ready to go. Because of the time of the year we went, there was no need for bug repellent and the temp was approximately 54F. Prior to getting to the top of the trail that leads to general Sherman, there is a handicap parking lot at the bottom of the trail so there is no need to walk the entire trail if someone in your party can not hike for long distance. Keep in mind the change in temperature that will occur as a result of traveling 6000+ feet up. In Visalia it was 89F and as mentioned above, it was close to 54F up there. Views are breathtaking. Highly recommend coming up here.","June 4, 2019",General Sherman ,4,"Rosamond, California",5
Sequoia National Park,"The massive size of the sequoias is something to behold. We visited with family and it started snowing while we were there visiting the General Sherman tree, making it seem all the more spectacular. Well worth visiting.","May 30, 2019",Impressive trees,38,"Canberra, Australia",5
Sequoia National Park,"If you're not humbled and in awe of these trees, then you are not human. Much like the Grand Canyon, it is impossible to catch the feeling in a photo or put into words. You just have to see it.Moro Rock is a ""must-hike"" if you can stomach the vertigo (even if you think you can't - power through it, you can thank me later).Take the shuttle from the museum to Moro Rock and do that hike, then jump back on the shuttle and go over to Crescent Meadows and take the stroll around and get up close and personal with the trees. My advice that seemed to work well for us - start at the Three Rivers entrance AS EARLY AS YOU POSSIBLY CAN in the morning to ""get ahead"" of the crowds. Since the road is basically the only one going through the park, you will be at the front of the ""train"" of people arriving later. You'll be the first to the major attractions like Moro Rock, and will enjoy relative solitude on the way up. On your way down, you'll notice more people showing up to start their journey, but you'll be on to the next place where you'll again be in relative solitude. Rinse, repeat. Do the Kings' Canyon at the end of the day, since this is the less popular (but still beautiful) side of the parks.Don't expect to get clean shots at the big attraction: General Sherman. Too many people. But if you do get the rare chance to be the only one in the picture with the tree, snap your pic quickly and let the next people go. If everyone did this, everything would work smoothly. ","May 30, 2019",BIG TREES!!! BIG HIKES!!! BIG FUN!!!,45,"Las Vegas, Nevada",5
Sequoia National Park,"I think I'll add something different from the usual. No doubt the giant beautiful and majestic Sequoias, including General Grant and General Sherman, are worth the visit. But if you're fortunate enough to notice and appreciate the following, then that is a bonus. It occurred when we left the park early to avoid the traffic jam that would come when most visitors left before a 6 p.m. closure because of impending snow.Route 180 out of the park often has 10-mile-an-hour curves. Often as you round them, your car's engine is so quiet and there are no birds or wind that you are in utter tranquil silence. That is as enjoyable as the fantastic scenery.","May 26, 2019",Utterly majestic.,80,"peachtree city, ga",5
Sequoia National Park,"Wow, what a stunning place Sequoia National Park is! We are on road trip but this wasn’t on our trip list, however, due to unforeseen circumstances we had to take a detour to Bakersfield and so a stop at Sequoia worked out well, and I was bowled over. To get into the park you have to pay a fee of $35, but it’s a 7 day pass, although we only had the one day. We decided on the Forest of the giant trees and it was amazing. Whilst it had and was snowing it added to the Beaty of the park. If you are going to do any of the trails, wear comfortable shoes, trainers should be fine, and consider the weather conditions in advance. There are rest rooms and there was also a trailer for purchasing snacks, although it was closed. This Forest was enchanting, and if you are around for a few days then I would recommend a couple of visits. The absolute highlight was the General Sherman, the oldest living thing in the world, a must see and the photos do not do it justice.","May 25, 2019",Big is definitely beautiful!,2,"Chigwell, United Kingdom",5
Sequoia National Park,"Hoping to see the big trees, we entered the park but the ranger accurately told us that it was an hour drive to get to them. We hoped she was wrong, but she wasn't. We drove in the curvy roads for nearly 30 minutes but realized that we wouldn't get to the big trees until late, so we turned around, disappointed.","May 23, 2019",Nice greeting at entrance but distance to big trees was an hour.,155,"Colorado Springs, Colorado",4
Sequoia National Park,"We recently visited several national parks in California this past April including two days in Sequoia National Park. We found this to be a great park for easy and short hikes and we very enjoyed being able to see the giant sequoias with snow on the ground. During our time in Sequoia National Park we stayed at the Wuksachi Lodge just off the General's Highway. This is an excellently located property just a few miles from the Giant Forest and much sightseeing in this area of the national park. We had a poor dinner at their feature restaurant called The Peak. However, there is a Lodgepole Village store nearby where we found a casual grill and were able to pick up traditional supermarket foods which were consumed in our hotel. We very much enjoyed the hikes and being able to spend time amongst the hundreds of giant sequoias in the Giant Forest. We hiked the General Sherman, Congress and Big Tree Trail, all of which were enjoyable. We also had a good time hiking out to Moro Rock and the Tunnel Log along the Crescent Meadow Trail, which starts at the Giant Forest Museum. The museum was worth the 30 minutes spent here, learning about the giant sequoias, their life cycle and the grove in general. Note that during the winter months, while the Lodgepole Visitor Centre is closed, the Giant Museum serves as a backup visitor centre, a good place to talk to rangers and to find out information about trail and road conditions. Parking was not an issue first thing in the morning but as more and more vehicles poured into the park by midday we found it more challenging to find spots near the areas we wanted to hike. There is a large carpark just across from the museum as well as free Sequoia shuttle service although we didn't find need to make use of this service during our late April visit. In the end, we found 2 days to be a fair amount of time to see the highlights such as the General Sherman Tree and those mentioned above. However, it is not enough time to explore the national park more thoroughly. For that, we would have preferred a couple more days, especially for taking in longer hikes. This is a national park that we look forward to visiting again in the future.","May 22, 2019",Land of the giant sequoias,18552,"Hong Kong, China",5
Sequoia National Park,The trees are amazing and blow your mind when you see them in person. We also hiked over to Moro Rock and climbed to the top and had some amazing views. It was pretty incredible and was the highlight of our trip to Sequoia national park.This is a National park that you won't want to miss.5 Stars.,"May 20, 2019",You have to see these trees to believe them,7,"Lenexa, Kansas",5
Sequoia National Park,"If you’re looking for a place to be one with nature, this place is the place to go to.The drive is is awesome, and of course a great place to take fantastic photographs.The staff there are friendly and helpful, and of course they even have a mini store and it’s a great place to get food, drinks, snacks, souvenirs, etc.Tips:* The area has bad or close to no reception for phones.* be ready with snow chains and foggy weather during winter months, so expect some roads to be closed at times.* take heed to warnings given, as this will Definitely save your life..... like NOT to feed the bears.*Its a great place to go camping, I’d definitely recommend to try it out. Plus they have places to have showers and laundry mats open at certain times of the day.* great place to hikeWill definitely be back again in the near future with my wife, and next time I’m bringing friends and family ","May 19, 2019",Great place,28,"Spring Valley, California",5
Sequoia National Park,This is one of the best national parks. It is not too overcrowded and it is quite pleasant. Trails are not too difficult and the trees are awesome. This is something that we all need to see. The Sequoia’s are some of the largest trees on earth and some of the oldest living things. ,"May 17, 2019",Must See,531,"Cincinnati, Ohio",5
Sequoia National Park,"I have uterrly fallen in love with this place. I was wanting to drive on the Generals Highway from Grant Grove to Three Rivers but due to the fact that it was March and the road was still closed at certain points, we decided to go straight to Three Rivers and go up to General Sherman from there. We had a rental so snow chains were out of the question so it was very much in the hands of the universe. Weather seemed decent the few days before so we were hopeful. It was super sunny in Three Rivers (shorts and t-shirt sunny) so we stopped for a quick break and to check what's happening up top. A nice fella from a shop told us that it snowed the night before so we definitely need chains from mid way cause the temperature changes fast and it's much colder but to go ask the rangers. We drove to the park entrance and to our luck, the snow chain restrictions were lifted 5 minutes before and we were okay to go up. The road is amazing! Beautiful to drive on! The views till about 1500m are your typical mountain views. Once you go past the cloud barrier it becomes quite cold and surprise, quite snowy! It was end of March so I wasn't expecting that much snow, but it was a happy surprise. I've never seen sequoias before and I was just stunned by the beauty - amazingly high trees with 2 meters of snow around! Parking was a bit of a pain but we waited patiently and we found a place. We then walked 1 minute to see General Sherman! Majestic, so so majestic! I loved it so much. Although super snowy, the temperature wasn't too bad, but still thick jacket and proper winter shoes were needed. I would love to come back in the summer and do the whole road but I'm so happy I got to see it in winter. So beautiful, I didn't want to leave. If you have the chance, go both seasons! Worth it, even the hassle of putting snow chains if needed. Wish we had more time to go do some hikes and take our time in the park. Definitely recommend!!!","May 16, 2019",Fell in love with this place,51,"Teddington, United Kingdom",5
