national_park,review_body,review_date,review_title,helpful_vote,user_location,user_rating
Sequoia National Park,"Such a beautiful national park! It was for sure worth the drive up the winding roads. The Sequoia trees are stunning but there are still a lot else to enjoy, especially if it has recently snowed","April 29, 2019",Breath taking experience!,8,"Varde, Denmark",5
Sequoia National Park,"We entered the park about 10:30 am through the Ash Oak entrance just after Three Rivers (last place for chains is just before the enraince (Totem market and gifts) and took the main road North to the big trees. If you are prone to car sickness and/or have difficulty driving twisty roads and want to see the bigger trees, don't use this entrance. Going North on this road, the roads are so twisted, it looks like a toddler scribbled on the map, and they based the road on that. I don't suffer car sickness and got a bit dizzy on the drive. If you do get car sick, you should instead enter through the Big Stump entrance and drive South to the big trees. This wont work if you want to see the other parts of the park near the ""scribbled"" road, only if you're interested in JUST the larger trees and in the winter/spring, snow and snowplay. You can avoid the worst of the road driving from North to the South. Now, if you're prone to issues with heights? You'll want to drive the opposite way, South to North, that way you're driving up the worst of the roads and you can't see directly how steep it is were you to drive down. I absolutely believe everyone should drive through if possible instead of doubling back. We drove through, stopping wherever we saw something interesting. With the heavy rains this year, the rivers and waterfalls were full, the park has its own super bloom of wildflowers, and there was plenty of snow at the higher elevations. We greatly enjoyed the giant forest museum. If you park in the farthest parking lot, there's a staircase you'll need to walk down to get to the museum, with the snow I don't remember seeing a ramp, but there appeared to be closer handicapped parking if you have a placard. Right by these steps are some rocks that are the perfect place to stand to get a photo with the Sentinel tree, which sits just outside the museum. You'll be able to see the entire tree in your photo with your family at close range. I would recommend the museum to everyone first, it's quick and easy and has a little store and a kid's activity packet. From there I would do the big trees trail - ""a panel near the start of Big Trees Trail explains: In Giant Forest, sequoias grow bigger than anywhere else, and Round Meadow is one of the best sequoia habitats within the Giant Forest.""Hikespeak. Even in late April, there was so much snow that the trail was mostly covered. We're mostly sure we hiked the trail thanks to the markings in the trees. However, after 30 minutes we had to turn back as downed trees and deep snow prevented us from seeing where the trail continued. I'm told the path is paved and mostly flat, but could not verify this due to the 8-12 plus inches of snow, slush, and ice. We had the kids in snow and hiking boots, but my friend and I both wore tennis shoes that made walking in the snow very difficult. I would love to go back here and do the congress trail as well, based on what I saw, I'm thinking it would be less steep than to do the general Sherman trail with the 200+ foot elevation changes and many stairs. Take your time up here, the elevation makes things difficult. Make sure you hydrate well and don't refill bottles or wash food in bathroom sinks. I spent time explaining to a foreign tourist that she shouldn't wash her fruit in water marked not potable. There aren't a whole lot of bathrooms around here, bring clean water or use drinking fountains only, even to wash fruit. If you're someone who just wants to see the park and only do hikes of an hour or less, spend the day, you can take in some amazing vistas in a day. I do not recommend driving these roads at night. Bring an extra pair of shoes and socks, even waterproof hiking boots got soaked through in the snow. I recommend Wolverton for snow play, we found lots of people sledding there and just going there for the day to hang out and play.","April 29, 2019","This park is a must see, I enjoyed this almost more than Yosemite. Mobility/car sickness/driving tips included",89,"Redondo Beach, CA",5
Sequoia National Park,"The park is well maintained and we love they allow people to walk through one of the downed, hollowed trees. It really gives children a great perspective of the size. ","April 29, 2019","Wow, those are huge!",75,"Charlotte, North Carolina",5
Sequoia National Park,"We drove through, could not park in the parking next to the generals tree visitors center. We had a pick up camper, a camper on a pick up, and vehicles jack ass parked in the RV area. Beautiful trees and area anyway but we just cruised on through. Too many people in April, cannot imagine how it is during prime season, yuck!","April 28, 2019","Beautiful trees, Not enough parking",37,"Baker City, Oregon",2
Sequoia National Park,I'm happy we got to see this place. Everything was beautiful and it was also free on the weekend we visited. You should plan to arrive early because there's alot to see and you can definitely take some awesome pictures. Plus you're ticket is good for a week. ,"April 27, 2019",The world largest Tree,2,"Abingdon, Maryland",5
Sequoia National Park,"Yes - it predates Yosemite as a national park; kind of hard to fathom any ""terrible"" reviews. We spent a very short time there as we didn't have much time to begin with and drove down for the day from Modesto. Locking the keys in the rental car (who knew you can lock remote entry keys in a car? Mine you can't!) cost us more time as dealt with finding employees to let us use the phone, being on hold for a while, and waiting for the park-located AAA affiliated fellow to get there to unlock us (once Thrifty put us through to Chevrolet - which informed us that On Star wouldn't work ""in a National Park"" and that they were sending someone - which would have taken hours - the in-park guy cost us $70, but was there in a half hour). All that was forgotten, however, in the midst of the trees (and the snow, which, while temps in the foothills and valleys were near 90, was still over the roofs of the Lodgepole buildings). Everything here is big - the trees, the mountains, the granite peaks, the snowfall...no wondering why it was our second national park.We would have liked to go on to King's Canyon, but they don't sell gasoline in the parks and even though we certainly had enough, after the key incident I was a little paranoid about car issues (did I really know the gauge on this rental and how accurate it was at half a tank? How much farther could we really go???)Be prepared - dress accordingly (bring jackets in the spring even if it is 90 in Visalia), know your cell phone will be useless, stock up on snacks or whatever (although there is a small shop and snack bar at Lodgepole).Also, going in to the park through the small foothill towns of Lemon Cove (full of orange groves), Three Rivers, etc., is an experience in itself.","April 22, 2019","Our Second National Park, First in California",347,"new haven, ct",5
Sequoia National Park,"A lovely reminder of how small we truly are, and a great place to reflect and find perspective. S.N.P is most definitely in my top 5 favorite national parks. I recommend Moro Rock trail and seeing General Sherman (Gen Sherm). ","April 19, 2019",Stunning ,2,"Eau Claire, Wisconsin",5
Sequoia National Park,This is a great day trip and you can spend hours on trails or just in your car. Dress accordingly as the temperature can change from the bottom to the top.,"April 13, 2019",Day trip ,1,,5
Sequoia National Park,We had an amazing trip with a curious 6YO. There was so much to see and do. The Jr Ranger Program is perfect! The only thing that needs to change is a parkwide smoking ban.,"April 13, 2019",So beautiful,1,"Lake Forest, California",5
Sequoia National Park,"I am so glad I came to this park. There was still snow on the ground and some of the park was closed, but it was well worth it. I can't get enough of the trees. I have never seen anything like them. It felt like I was in the land of the dinosaurs. I have always heard about them, but seeing them up close was the best. The views from the park were great as well.","April 10, 2019",A great park with wonderful views and crazy massive trees,48,South Florida,5
Sequoia National Park,"We visited Sequoia National Park for half a day on a beautiful spring afternoon. This park is spectacular. We entered the park at the Ash Mountain entrance and drove on Generals Highway to Wuksachi Lodge. We saw beautiful blooming trees, Moro Rock, waterfalls, snow-covered mountain peaks and and blanketed groves, giant sequoias, and General Sherman tree. We had planned to drive all the way to Kings Canyon Visitors Center but the Generals Highway was closed after Wuksachi Lodge.","April 8, 2019",Spring afternoon at Sequoia National Park,20,"San Francisco, California",5
Sequoia National Park,"The drive up is full of unbelievably beautiful scenery. Super steep curvy roads straight up the mountain, with lots of wildlife. From 65 to 40 degrees in just a few minutes. The trees are amazing!","March 30, 2019",Beautiful!,22,"Bixby, Oklahoma",5
Sequoia National Park,"If you've never been here before, I hope the recent fires in the vicinity (and at other parks) have pushed you to visit Sequoia in case anything should ever happen to it.If you're coming from SoCal and Yosemite seems like too far a drive (or you can't get reservations) this is a great option to see exquisite nature closer to home. If you think large trees are boring, think again. You will be astonished at the monumental size of these giants and the easy walks that lead you through them. While turnouts and less popular trails are not as easy to find as they are in other parks, the main points of interest (General Sherman, Giants Walk) will give you enough for a two-day trip. Many campsites are available with varying amenities (sans crowds and feeling like you are at the Disneyland of national parks.) Quieter facilities with better privacy and shade EVERYWHERE makes this a perfect spot for a summer weekend, even in the heat as the shade areas do not heat up as much.Tip: Since it is more secluded, convenience stores are not as readily available as in other parks. Bring plenty of snacks and food from the grocery stores in Visalia and you'll avoid driving the winding roads for food you don't even like.Yes, there is shade, but never substitute that for sunscreen!","March 24, 2019","The Closer, Quieter National Park",56,"Los Angeles, California",4
Sequoia National Park,I enjoyed the visit to Sequoia with the beautiful and giant trees. I have never seen a thing like this before. The nature the roads through the park everything is beautiful!,"March 24, 2019",One of the best places on earth,4,"Virginia Beach, Virginia",5
Sequoia National Park,Great place for playing in the snow. Beautiful scenery and we love the Sequoias. Carry chains though in the winter.,"March 19, 2019",Snow time!,2,"Visalia, California",5
Sequoia National Park,"We visited over the weekend when it was not snowing but there was lots of settled snow. A lot of trails were closed for vehicles. We did not do much of hiking but did lots of snow play. We did see General Sherman and it is majestic.Couple of tips:In case you are visiting during winter,1. Carry chains even if the weather is clear. The weather could change anytime2. If it has snowed, the road from Three rivers is the only way to reach the park.In case you are staying at Wuksachi and travelling from SFO area, sometimes maps directs you from the other highway from Kings canyon side. This road is mostly CLOSED if it has snowed. So during winter, make sure you check which road is open. 3. Weather changes constantly during winter, so make sure you follow the weather updates a couple of days in advance and enter the park accordingly. We realised that there were days they did not allow vehicles to enter after 5pm when it snowed heavy.This is an amazing park. It is not too crowded . Would love to come back during summer.","February 28, 2019",Magical!!,30,"Fremont, California",5
Sequoia National Park,We when there and stopped many times for breath taking pictures at every stop. When we got to about 8000 feet here was snow and of course a snowball fight. I will return to see more of this great park.,"January 23, 2019",What a wonderful Park!,111,"DeBary, Florida",5
Sequoia National Park,"We were there on one of the first days of the recent government shutdown, so we got in for free. Being December there were warning signs about the need for chains and we made up to about 2 miles from the Sherman Sequoia, but gave up because there was someone in a sports car who had rented chains, but couldn't seem to get them on correctly and they were holding up traffic!! Also, because of the time of year, there was some snow which was cool, but there was a tremendous amount of fog so we couldn't fully appreciate the views but did find what we could see to be ABSOLUTELY AMAZING! Pictures of these magnificent trees do them NO justice--you HAVE to see them in person!! Can't wait to go back when the weather is clearer.","January 15, 2019",A MUST SEE,29,Gordonsville,5
Sequoia National Park," It is a place that makes us feel small in the grandeur of nature.Is a very interesting park, make sure to visit the museum.","January 8, 2019",Impressive,38,"Lisbon, Portugal",5
Sequoia National Park,"Going into the Sequoia national Park and Kings national Park is a wonderful day outing. Make sure you to spend time at the General Sherman Tree. Allow plenty of time to wander from one area of interest to another; especially in the fall and winter, as the park goes to desk and dark much sooner then in the spring and fall.","January 6, 2019",Great outing at the Sequoia & Kings National Park,5,"Visalia, California",5
Sequoia National Park,"Federal government shutdown, no entrance fee, but we didn’t know road was closed until we got halfway to the top... we rented chains, but did not have a chance to use them. We had to go back and could not see the main attractions in a clear and sunny day. But the area is amazing anyway.","December 30, 2018",It could have been greater..,46,"Sao Paulo, SP",4
Sequoia National Park,This is a beautiful place you should not miss if you’re in the area. Make sure you wear good shoes and warm clothes if visiting during the winter months. Our family enjoyed the beautiful scenery and huge trees! ,"December 25, 2018",Amazing place! ,16,"San Antonio, Texas",5
Sequoia National Park,"Such a short drive up to the Sequoias and it's so beautiful. Clean, clear air, nice and cool with some snow now. The Sequoia trees are huge! ","December 11, 2018",Such beauty in our own backyard,35,California,5
Sequoia National Park,Mother Nature at her finest. Beauty everywhere. Still get a kick driving through the Redwood tree trunk.,"December 11, 2018",Awe inspiring,0,,5
Sequoia National Park,"The park is magical. There is so much to see, there's no way to see everything in a single trip. From spotting wildlife to the awe-inspiring giant sequoias to the breathtaking mountain and river scenery, there's something amazing around every corner. The drive up starts out as beautiful high desert views with live oaks and wild flowers and the higher you go in altitude, the more lush and dense the forest becomes until you reach the giant sequoia trees. A great place for a day trip and nice picnic and short hike, or for the more adventurous, you can hike into the back country and experience nature virtually untouched by humans. The park can be very crowded during weekends and holidays - my advice is if you are going for the day to start up super early and either do the loop or what we typically do, which is start from Visalia and go up as high as Wuksachi and then back down, making different stops on the way up and down. There are several places to stop along the way to picnic or hike. Giant forest has a beautiful walk around Crescent Meadow and a really nice picnic area at Pinewood. Across from Hospital Rock picnic area, there is an awesome spot to see ancient Native American pictographs, which is yet another aspect to the park. As long as you start your trip very early (we try to leave by 6:30 a.m.), you can get up and do what you want without the traffic and crowds on weekends and holidays. As you make your way down to leave the park, you will see what I mean! The traffic can be bumper to bumper and all the spots super crowded. Week days are definitely better if you're able to swing it.All this sightseeing is going to make you hungry and there are not many places to stop to buy food, so be sure to come prepared! Lodgepole, which is quite a ways up from Visalia (about 1 hour 45 mins), does offer a grocery store and small restaurant with pre-packaged sandwiches and salads, but the groceries are super expensive so I strongly advise that you bring an ice chest and your own food! It can be a tough day for very young children because it's a lot of driving, and the drive is twisting and turning. Head's up if you are someone who gets car sick! Bottom line though, it's something everyone should see if you have any interest whatsoever in nature. People visit from all over the world, and with good reason!","November 13, 2018",Nothing Like it in the World - Pack your lunch!,7,"Visalia, California",5
Sequoia National Park,Weather is nice in November. Would like to see crystal cave in the summer and use the lodge next time ,"November 8, 2018",park with different views ,12,"New York City, New York",5
Sequoia National Park,"We were only in California for a few days and my cousin lives in Visalia, CA so she decided to take us to Sequoia National Park. It's definitely a long drive but well worth it. Entrance fee is $35 per car and the lady had mentioned about a shuttle, but there was so many of us that I couldn't understand what the shuttle was for. The trip itself to get to the park was tedious and very long. Going up the mountain was an adventure of its own. With so many turns and winding roads, it felt nauseating to be the passenger. But with many spots to take pictures of the view, it was well worth it. You can't beat the view. The mountains and the trees was breathtakingly beautiful. When we finally got up to the park and walked to the biggest tree known as the General Sherman, it was well worth the trip. I've never seen anything like it. These sequoia trees are huge! It's so beautiful to look at, that I was lost for words because I've never seen anything like it. From what I gathered during our trip, there are many campgrounds and lodges throughout the park. I did see a Crystal Cave tour but it was closed for the season as well as a tour to Moro Rock but we missed the shuttle bus for that. For anyone who wants to visit this beautiful park, plan ahead and leave early. There's so much to do here that I feel like we didn't even touch the surface of this park. Definitely check out there website and plan ahead. This must be in everyone's to-do list.","November 7, 2018",Amazing,19,"Gurnee, Illinois",5
Sequoia National Park,"We decided to do the Crystal Cave tour, which was really fun and the cave was beautiful! Our guide taught us so much about the history of the cave and the park as a whole. The sequoias are about an hour drive from the entrance of the park, but along the way there are tons of places to stop to take in the view (and there are some waterfalls too)! Overall, Sequoia National Park is amazing.","October 24, 2018",Beautiful ,1,"San Diego, California",5
Sequoia National Park,Or family vacation included a stop here and it didn’t disappoint! The tress were impressive and we loved them all. The shuttles from site to site were a nice convenience. We did the hike to the General which was relatively easy. The air at sequoia was sooooo fresh and clean and had a unique crispness to it. We loved our visit.,"October 21, 2018",Mountain air!,9,"Bismarck, North Dakota",5
Sequoia National Park,Visited on October 17th 2018. We wanted to see the giant sequoias. These are breathtaking (General Sherman & Sentential especially) but actually the entire park is spectacular. Wrap up. It gets cold the higher you go. As well as the beautiful trees our other highlights were on the way in and out of the park - bears! Including a mother and cub only 20ft away from us. What a day! Would highly recommend. ,"October 18, 2018",Breathtaking...,11,"Dublin, Ireland",5
Sequoia National Park,"This park is huge! It can take you an hour to drive from one spot to another. Entrance fee is $35. You can pre pay online to make things faster. We went in through the 198 entrance. The visitors center was a mile in. Don’t pass it up. They can help you plan your day based on how much time you have. On our way to our first stop, we saw a bear with its cub. That was awesome. We saw plenty of wildlife. They kept to themselves. We just admired fromafar. We stared at the Moro rock. We made the mistake of taking the trail by the museum. It added 1.3 miles one way and the last 400 stairs were no joke. With it being over 6000 feet above sea level, the air does thin out. It was worth it for the beautiful view. We even snacked on our peanut butter and jelly sandwiches on the top. If you don’t want to go the extra miles, just drive up to the bottom of the rock. Other notable hikes and spots include the Sherman tree, the tunnel log, the museum and the congress trail. There are many more, but I would have needed more than one day to explore it allParking wasn’t bad for October, but I can see how it would be difficult in the summer. They had a sign saying tire chains were required sat over 7000 feet, but the ranger told us we didn’t need them that day. We didn’t have any on us, so I’m not sure what would have happened if we needed them. Bathrooms are available at almost every major stop. Just remember these are pale bathrooms. They are basic and pretty much just a faculty with doors and stalls. They do have an area near the Sherman tree that has a store that sells almost anything you forgot. ","October 16, 2018","Amazing, huge trees ",167,"San Antonio, Texas",5
Sequoia National Park,"If you haven't seen the giant sequoias first hand, you are missing out of the greatest and most humbling experience of a lifetime. No matter the season it changes year around, it is a must see in person! A textbook, video or a picture does not do this place justice. You will see when you come up.","October 15, 2018",Giant Sequoias,2,"Visalia, California",5
Sequoia National Park,"It is a beautiful place to visit, the redwoods and sequoias are huge, and the walking trails in these forests are relaxing. The Moro rock and the trail to the top is a dare to expedition but one you are up there the views are amazing. Went at the end of the summer, can t imagine how great it must be in the spring.","October 14, 2018","Beautiful place, ",45,"Bogota, Colombia",5
Sequoia National Park,"This is the place to see lots of big big redwoods. You do need a car. There is so much to see, plan on a whole day just to get an overview. Stop get out and wander the trails.","October 14, 2018",Trees,225,"Vancouver, Canada",5
Sequoia National Park,Went with a group of friends for the weekend. The views are amazing. There are simple hikes and there are more complex ones; okay for kids. ,"October 10, 2018",Great trees,23,"Jacksonville, Florida",5
Sequoia National Park,Sequoia national Park is absolutely beautiful. Plan on taking several hours to get through it the roads are curvy and there is some road construction but it is well worth the wait if you have to stop. Make sure you stop at the visitor center and also get out and look around. The trees are absolutely indescribable. And when you try to tell your friends about it they will not realize how magnificent they are until they see them for themselves. If ever you get a chance to go do this park it is well worth the time and admission fee.,"October 10, 2018",Magnificent is an appropriate word,4,"Las Vegas, Nevada",5
Sequoia National Park,"Visited the National park to see the Sequoia trees. We were not disappointed. They are magnificent. Luckily for us, it was a sunny day, this made them look even more beautiful. Don’t drive past if you are in the area. They are too good to miss.","October 8, 2018",Tremendous Trees,214,"Dronfield, United Kingdom",4
Sequoia National Park,"Beautiful drive as soon as you enter the park, beautiful forest and amazing giant sequoias. Went straight to see general Sherman with it’s imposing size. Nice walk to the area including a fallen sequoia that has been made into a short tunnel. Loved the temperature too, only 65 F with a mild breeze. Other great areas throughout for walks and drives to take in the beauty of nature.","October 5, 2018",Walking among giants ,37,Miami,4
Sequoia National Park,"I couldn’t get over the Sherman tree it was so big. The path to the tree is well paved but it does have steps with no railings. Luckily I had hiking poles with me to help me navigate up and down the steps. The pamphlet about the park had us so scared about keeping food in our car due to the Bears, That we threw all our food away before entering the park. The end the only animals I saw were a chipmunk and a squirrel.","October 3, 2018",Totally awesome,8,Maryland,5
